group,latin_name,species,support,mode,submode,description,tooling_or_IOU,frame_of_reference,number_relations,temporal_order,1_dynamic_relation,2_dynamic_relation,manufacture,steps_manufacture,associative,type_associative,reference,total_references,page,comments,,,,,,,,,,,,,,,,,,,,,,,,,,,,,,,,,,,,,,,,,,,,,,,,,,,,,,,,
amphibians,Ceratophrys spp.,Horned frogs,,affix,dig_selfhide,bury selves with dirt,IOU,,,,,,,,,,,,36,,,,,,,,,,,,,,,,,,,,,,,,,,,,,,,,,,,,,,,,,,,,,,,,,,,,,,,,,
birds,Accipitridae sp.,Eagle,,drop,drop_threat,drop sticks at intruders,IOU,,,,,,,,,,,,37,,,,,,,,,,,,,,,,,,,,,,,,,,,,,,,,,,,,,,,,,,,,,,,,,,,,,,,,,
birds,Alectura lathami,Australian brush turkey,,drag,kick_threat,kick debris at predators/intruders,IOU,,,,,,,,,,,,39,,,,,,,,,,,,,,,,,,,,,,,,,,,,,,,,,,,,,,,,,,,,,,,,,,,,,,,,,
birds,Amazona aestiva,Blue-fronted Amazon parrot,anecdotal,scratch,scratch_autogroom,scratch self with stick,tooling,egocentric,1,stick to body,dynamic,,no,,no,,Boswall 1977,1,,Report of Blanden's observation.,,,,,,,,,,,,,,,,,,,,,,,,,,,,,,,,,,,,,,,,,,,,,,,,,,,,,,,,
birds,Amazona ochrocephala,Yellow-crowned amazon,anecdotal,contain,scoop_access, scoop seeds/water to eat/drink with toy,tooling,egocentric,1,toy to seed,dynamic,,no,,no,,Boswall 1983,1,49,Seen in only one captive animal,,,,,,,,,,,,,,,,,,,,,,,,,,,,,,,,,,,,,,,,,,,,,,,,,,,,,,,,
birds,Amazona sp.,Amazon parrot,anecdotal,scratch,scratch_autogroom,scratch self with spoon,tooling,egocentric,1,stick to body,dynamic,,no,,no,,Boswall 1983,1,48,Seen in only one captive animal. Pers comm. by G. Cashin,,,,,,,,,,,,,,,,,,,,,,,,,,,,,,,,,,,,,,,,,,,,,,,,,,,,,,,,
birds,Anodorhynchus hyacinthinus,Hyacinth macaw,,affix,place_wedge,place objects in beak to prevent slipping during extraction,IOU,,,,,,,,,,,,51,,,,,,,,,,,,,,,,,,,,,,,,,,,,,,,,,,,,,,,,,,,,,,,,,,,,,,,,,
birds,Aquila audax,Wedge-tailed eagle,,drop,drop_threat,drop objects on caretakers,IOU,,,,,,,,,,,,37,,,,,,,,,,,,,,,,,,,,,,,,,,,,,,,,,,,,,,,,,,,,,,,,,,,,,,,,,
birds,Ara ararauna,Blue-and-yellow macaw,anecdotal,scratch,scratch_autogroom,scratch self with bone,tooling,egocentric,1,stick to body,dynamic,,no,,no,,Boswall 1983,1,48,Seen in only one captive animal. Pers comm. by B. Hoad.,,,,,,,,,,,,,,,,,,,,,,,,,,,,,,,,,,,,,,,,,,,,,,,,,,,,,,,,
birds,Ardea goliath,Goliath heron,,bait,bait_hunt,place debris on water as  bait for fish,IOU,,,,,,,,,,,,40,,,,,,,,,,,,,,,,,,,,,,,,,,,,,,,,,,,,,,,,,,,,,,,,,,,,,,,,,
birds,Ardeola ralloides,Squacco heron,,bait,bait_hunt,place food on water as  bait for fish,IOU,,,,,,,,,,,,40,,,,,,,,,,,,,,,,,,,,,,,,,,,,,,,,,,,,,,,,,,,,,,,,,,,,,,,,,
birds,Athene cunicularia,Burrowing owl,,bait,bait_hunt,place dung near nest (to attract dung beetles as prey and/or signal occupation),IOU,,,,,,,,,,,,40-41,,,,,,,,,,,,,,,,,,,,,,,,,,,,,,,,,,,,,,,,,,,,,,,,,,,,,,,,,
birds,Avian spp.,Birds,,bait,bait_courtship,present gifts during courtship,IOU,,,,,,,,,,,,41,,,,,,,,,,,,,,,,,,,,,,,,,,,,,,,,,,,,,,,,,,,,,,,,,,,,,,,,,
birds,Bradornis microrhynchus,African grey flycatcher,anecdotal,probe,fish_access,probe holes with stems for termites,tooling,allocentric,1,stem to hole,dynamic,,no,,no,,Boswall 1983,1,47,Seen in only one animal,,,,,,,,,,,,,,,,,,,,,,,,,,,,,,,,,,,,,,,,,,,,,,,,,,,,,,,,
birds,Buteo regalis,Ferruginous hawk,,drop,drop_threat,drop stones at intruders,IOU,,,,,,,,,,,,37,,,,,,,,,,,,,,,,,,,,,,,,,,,,,,,,,,,,,,,,,,,,,,,,,,,,,,,,,
birds,Butorides striata,Striated heron,,bait,bait_hunt,place food/debris on water as  bait for fish,IOU,,,,,,,,,,,,40,,,,,,,,,,,,,,,,,,,,,,,,,,,,,,,,,,,,,,,,,,,,,,,,,,,,,,,,,
birds,Butorides virescens,Green heron,,bait,bait_hunt,place food/debris on water as  bait for fish,IOU,,,,,,,,,,,,40,,,,,,,,,,,,,,,,,,,,,,,,,,,,,,,,,,,,,,,,,,,,,,,,,,,,,,,,,
birds,Cacatua (unspecified),Cockatoo,,contain,scoop_unknown, scoop water with walnut shell (for unknown purpose),IOU,,,,,,,,,,,,49,Borderline (goal unclear),,,,,,,,,,,,,,,,,,,,,,,,,,,,,,,,,,,,,,,,,,,,,,,,,,,,,,,,
birds,Cacatua galerita,Sulphur-crested cockatoo,anecdotal,dig,dig_unknown,scrape floor soil with rock (possibly to loosen for gizzard grit),tooling,allocentric,1,rock to soil,dynamic,,no,,no,,Boswall 1983,1,42,Report of Kawata's observation. Seen in only one captive animal.,,,,,,,,,,,,,,,,,,,,,,,,,,,,,,,,,,,,,,,,,,,,,,,,,,,,,,,,
birds,Cacatua galerita,Sulphur-crested cockatoo,,drop,drop_threat,drop twigs on intruders,IOU,,,,,,,,,,,,37,,,,,,,,,,,,,,,,,,,,,,,,,,,,,,,,,,,,,,,,,,,,,,,,,,,,,,,,,
birds,Cacatua goffiniana,Goffin cockatoo/Tanimbar corella,anecdotal,pound,hammer_play,hit bell with container held in foot,tooling,allocentric,1,container to bell,dynamic,,no,,no,,Boswall 1983,1,42,Unclear if action is intentional; seen in only one captive animal,,,,,,,,,,,,,,,,,,,,,,,,,,,,,,,,,,,,,,,,,,,,,,,,,,,,,,,,
birds,Cacatua moluccensis,Salmon-crested cockatoo,anecdotal,scratch,scratch_autogroom,scratch self with stick/feather/wire,tooling,egocentric,1,stick to body,dynamic,,yes,1,no,,Boswall 1983,1,48,Seen in only one captive animal. Pers comm. by K. J. Bell. Bent detached feathers before using to scratch.,,,,,,,,,,,,,,,,,,,,,,,,,,,,,,,,,,,,,,,,,,,,,,,,,,,,,,,,
birds,Cacatua sanguinea,Little corella,anecdotal,scratch,scratch_autogroom,scratch self with matchstick,tooling,egocentric,1,stick to body,dynamic,,no,,no,,Smith 1970,1,47,Seen in only one captive animal,,,,,,,,,,,,,,,,,,,,,,,,,,,,,,,,,,,,,,,,,,,,,,,,,,,,,,,,
birds,Cacatua sulphurea,Sulphur-crested cockatoo,anecdotal,contain,scoop_access, scoop water to drink with nutshell/bottle top,tooling,egocentric,1,shell to water,dynamic,,no,,no,,Boswall 1983; Smith 1971,2,49,Seen in two separate captive animals.,,,,,,,,,,,,,,,,,,,,,,,,,,,,,,,,,,,,,,,,,,,,,,,,,,,,,,,,
birds,Cacatua sulphurea,Sulphur-crested cockatoo,anecdotal,scratch,scratch_autogroom,scratch self with stick,tooling,egocentric,1,stick to body,dynamic,,no,,no,,Smith 1971,1,47,Seen in two separate captive animals. Accounts reported from R. Low (unclear if her own obervations related).,,,,,,,,,,,,,,,,,,,,,,,,,,,,,,,,,,,,,,,,,,,,,,,,,,,,,,,,
birds,Cacatua sulphurea citrinocristata),Citron-crested cockatoo,anecdotal,scratch,scratch_autogroom,scratch self with spoon,tooling,egocentric,1,stick to body,dynamic,,no,,no,,Boswall 1983,1,48,Seen in only one captive animal. Pers comm. by B. Hoad.,,,,,,,,,,,,,,,,,,,,,,,,,,,,,,,,,,,,,,,,,,,,,,,,,,,,,,,,
birds,Camarhynchus heliobates,Mangrove finch,anecdotal,probe,probe_access,probe in holes with sticks for prey,tooling,allocentric,1,stick to hole,dynamic,,yes,1,no,,Curio & Kramer 1964,1,44,Seen in only one wild animal (multiple times by same male; over several days only one to do so of six finches),,,,,,,,,,,,,,,,,,,,,,,,,,,,,,,,,,,,,,,,,,,,,,,,,,,,,,,,
birds,Camarhynchus pallidus,Woodpecker finch,observational,jab,jab_hunt,impale insects inside holes with twigs/cactus spines,tooling,allocentric,1,twig to insect,dynamic,,yes,1,no,,"Bowman 1961; Eibl-Eibesfeldt 1961; Hundley 1963; Lack 1947, 1953",5,,,,,,,,,,,,,,,,,,,,,,,,,,,,,,,,,,,,,,,,,,,,,,,,,,,,,,,,,,
birds,Camarhynchus pallidus,Woodpecker finch,anecdotal,jab,jab_threat,prod conspecific aggressively,tooling,allocentric,1,twig to conspecific,dynamic,,no,,no,,Millikan & Bowman 1967,1,43,Seen in only one captive animal (part of experimental group held in captivity),,,,,,,,,,,,,,,,,,,,,,,,,,,,,,,,,,,,,,,,,,,,,,,,,,,,,,,,
birds,Camarhynchus pallidus,Woodpecker finch,observational/experimental,probe,probe_access,probe in holes with sticks/cactus spines for prey,tooling,allocentric,1,stick to hole,dynamic,,yes, 1-2,no,,"Bowman 1961; Eibl-Eibesfeldt 1961; Eibl- Eibesfeldt & Sielmann 1962; Gifford 1919; Hundley 1963; Lack 1947, 1953; Merlen & Davis-Merlen 2000; Millikan & Bowman 1967; Tebbich et al. 2001; Tebbich et al. 2002; Tebbich & Bshary 2004",12,43-44,"carry tools from tree to tree. Adjust posture/manipulation for optimal use. no evidence for social learning of tool use. May not only detach stick and adjust its length by subtraction, but may also remove twiglet protrusions (but do not plan this ahead)",,,,,,,,,,,,,,,,,,,,,,,,,,,,,,,,,,,,,,,,,,,,,,,,,,,,,,,,
birds,Camarhynchus pallidus,woodpecker finch,observational,pry,pry_access,pry out insects with twigs/cactus spines,tooling,allocentric,1,twig to insect,dynamic,,yes,1,no,,"Bowman 1961; Eibl-Eibesfeldt 1961; Hundley 1963; Lack 1947, 1953",5,42,,,,,,,,,,,,,,,,,,,,,,,,,,,,,,,,,,,,,,,,,,,,,,,,,,,,,,,,,
birds,Camarhynchus pallidus,woodpecker finch,anecdotal,pry,pry_remove,flip over branch epiphyte with bark piece (to search for insects),tooling,allocentric,1,bark to epiphyte,dynamic,,no,,no,,Greenhood & Norton 1999,1,42,Seen in only one wild animal,,,,,,,,,,,,,,,,,,,,,,,,,,,,,,,,,,,,,,,,,,,,,,,,,,,,,,,,
birds,Camarhynchus pallidus,Woodpecker finch,anecdotal,pry,pry_unknown,pry bark/camera buttons/human toes with twigs,tooling,allocentric,1,stick to bark,dynamic,,no,,no,,Merlen & Davis-Merlen 2000,1,42,Seen in only one captive animal,,,,,,,,,,,,,,,,,,,,,,,,,,,,,,,,,,,,,,,,,,,,,,,,,,,,,,,,
birds,Certhidea olivacea,Green warbler-finch,anecdotal,probe,probe_access,probe in crack with stem for prey,tooling,allocentric,1,stem to crack,dynamic,,no,,no,,Hundley 1963,1,44,Seen in only one wild animal. Unsuccessful at securing an insect.,,,,,,,,,,,,,,,,,,,,,,,,,,,,,,,,,,,,,,,,,,,,,,,,,,,,,,,,
birds,Ceryle rudis,Pied kingfisher,,bait,bait_hunt,place food on water as  bait for fish,IOU,,,,,,,,,,,,40,,,,,,,,,,,,,,,,,,,,,,,,,,,,,,,,,,,,,,,,,,,,,,,,,,,,,,,,,
birds,Chlamydera spp.,Bowerbirds,,affix,place_decor,"""paint"" bower by applying various items (e.g. masticated charcoal, mud etc)",IOU,,,,,,,,,,,,51,,,,,,,,,,,,,,,,,,,,,,,,,,,,,,,,,,,,,,,,,,,,,,,,,,,,,,,,,
birds,Chlamydera spp.,Bowerbirds,,bait,bait_courtship,hold bower decorations in bill and toss at females,IOU,,,,,,,,,,,,41,,,,,,,,,,,,,,,,,,,,,,,,,,,,,,,,,,,,,,,,,,,,,,,,,,,,,,,,,
birds,Ciconia ciconia,White stork,,contain,wring_access,wring water from wet moss,IOU,,,,,,,,,,,,49,,,,,,,,,,,,,,,,,,,,,,,,,,,,,,,,,,,,,,,,,,,,,,,,,,,,,,,,,
birds,Colluricincla harmonica,Grey shrikethrush,anecdotal,probe,probe_access,probe hole with twig  for prey,tooling,allocentric,1,twig to hole,dynamic,,no,,no,,Mitchell 1972,1,44,Seen in only one animal.,,,,,,,,,,,,,,,,,,,,,,,,,,,,,,,,,,,,,,,,,,,,,,,,,,,,,,,,
birds,Columba livia,Rock pigeon,,prop,prop_access,push box to climb up and reach banana,IOU,,,,,,,,,,,,49,,,,,,,,,,,,,,,,,,,,,,,,,,,,,,,,,,,,,,,,,,,,,,,,,,,,,,,,,
birds,Columba livia,Rock pigeon,experimental,reach,reach_access,push box to touch plate,tooling,allocentric,1,Box to plate,dynamic,,no,,no,,Epstein & Medalie 1983,1,43,"Seen in only one captive animal. Pigeon trained separately to push box, and to touch plate.",,,,,,,,,,,,,,,,,,,,,,,,,,,,,,,,,,,,,,,,,,,,,,,,,,,,,,,,
birds,Corcorax melanorhamphos,White-winged chough,anecdotal,pound,hammer_open,hammer on mussel with mussel whole/piece,tooling,allocentric,1,mussel to mussel,dynamic,,no,,no,,Hobbs 1971,1,41,,,,,,,,,,,,,,,,,,,,,,,,,,,,,,,,,,,,,,,,,,,,,,,,,,,,,,,,,
birds,Corcorax melanorhamphos,White-winged chough,,throw,throw_open,drop mussels to break open other mussels,IOU,,,,,,,,,,,,39,,,,,,,,,,,,,,,,,,,,,,,,,,,,,,,,,,,,,,,,,,,,,,,,,,,,,,,,,
birds,Corvid spp.,Crows,,affix,wipe_selfanoint,"apply smoke/embers to plumage (a type of ""anting""?)",IOU,,,,,,,,,,,,51,,,,,,,,,,,,,,,,,,,,,,,,,,,,,,,,,,,,,,,,,,,,,,,,,,,,,,,,,
birds,Corvus albus,Pied crow,,drop,drop_open,drop stones to break ostrich eggs,IOU,,,,,,,,,,,,37,,,,,,,,,,,,,,,,,,,,,,,,,,,,,,,,,,,,,,,,,,,,,,,,,,,,,,,,,
birds,Corvus brachyrhynchos,American crow,,affix,place_hide,place paper towel over container,IOU,,,,,,,,,,,,52,,,,,,,,,,,,,,,,,,,,,,,,,,,,,,,,,,,,,,,,,,,,,,,,,,,,,,,,,
birds,Corvus brachyrhynchos,American crow,,contain,contain_hold,transport food/water/items with cup/nozzle/toy,IOU,,,,,,,,,,,,49,Seen in only one captive animal. Unclear if goal directed.,,,,,,,,,,,,,,,,,,,,,,,,,,,,,,,,,,,,,,,,,,,,,,,,,,,,,,,,
birds,Corvus brachyrhynchos,American crow,anecdotal,contain,scoop_access, scoop water with cup in order to wet mash,tooling,allocentric,1,cup to mash,dynamic,,no,,no,,Beck pers obs; Hess pers. Comm,2,49,Seen in only one experimental captive animal. Pers comm/pers obs,,,,,,,,,,,,,,,,,,,,,,,,,,,,,,,,,,,,,,,,,,,,,,,,,,,,,,,,
birds,Corvus brachyrhynchos,American crow,,drop,drop_threat,drop objects on intruders (or as play),IOU,,,,,,,,,,,,38,,,,,,,,,,,,,,,,,,,,,,,,,,,,,,,,,,,,,,,,,,,,,,,,,,,,,,,,,
birds,Corvus brachyrhynchos,American crow,anecdotal,jab,jab_threat,thrust at jay with stick,tooling,allocentric,1,stick to jay,dynamic,,no,,no,,Balda 2007,1,43,Seen in only one animal,,,,,,,,,,,,,,,,,,,,,,,,,,,,,,,,,,,,,,,,,,,,,,,,,,,,,,,,
birds,Corvus brachyrhynchos,American crow,anecdotal,pound,hammer_open,hammer acorn with rock,tooling,allocentric,1,rock to acorn,dynamic,,no,,no,,Boswall 1977,1,41,Pers. comm. by F. Duvall (relayed by Boswall),,,,,,,,,,,,,,,,,,,,,,,,,,,,,,,,,,,,,,,,,,,,,,,,,,,,,,,,
birds,Corvus brachyrhynchos,American crow,anecdotal,probe,probe_access,probe hole with wood piece  for prey,tooling,allocentric,1,wood to hole,dynamic,,yes, 1-2,no,,Caffrey 2000,1,47,"Seen in only one animal. Detached piece from fence rail, used its beak to create a tapered end and used to investigate hole in same fence.",,,,,,,,,,,,,,,,,,,,,,,,,,,,,,,,,,,,,,,,,,,,,,,,,,,,,,,,
birds,Corvus brachyrhynchos,American crow,,prop,prop_access,reposition perch to reach object,IOU,,,,,,,,,,,,49,,,,,,,,,,,,,,,,,,,,,,,,,,,,,,,,,,,,,,,,,,,,,,,,,,,,,,,,,
birds,Corvus brachyrhynchos,American crow,experimental,pry,pry_press,use rod/matchstick as lever between panel and key (to operate panel more efficiently),tooling,allocentric,1,rod to panel,dynamic,,no,,no,,Powell & Kelly 1975,1,42,Considered innovative behaviour,,,,,,,,,,,,,,,,,,,,,,,,,,,,,,,,,,,,,,,,,,,,,,,,,,,,,,,,
birds,Corvus brachyrhynchos,American crow,experimental,reach,push_access,push out of reach key with object,tooling,allocentric,1,object to key,dynamic,,no,,no,,Powell & Kelly 1975,1,43,"Crows were trained with matchsticks or rods, but behaviour generalized to other objects",,,,,,,,,,,,,,,,,,,,,,,,,,,,,,,,,,,,,,,,,,,,,,,,,,,,,,,,
birds,Corvus brachyrhynchos,American crow,experimental,reach,reach_access, reach food with sticks/hooks,tooling,allocentric,1,stick/hook to food,dynamic,,no,,no,,MacDonell 2000,1,43,placement of food reward in respect to stick/hook unknown (paper inaccessible),,,,,,,,,,,,,,,,,,,,,,,,,,,,,,,,,,,,,,,,,,,,,,,,,,,,,,,,
birds,Corvus brachyrhynchos,American crow,anecdotal,scratch,scratch_autogroom,scratch self with toy,tooling,egocentric,1,toy to body,dynamic,,no,,no,,Cole 2004,1,48,Seen in only one captive animal,,,,,,,,,,,,,,,,,,,,,,,,,,,,,,,,,,,,,,,,,,,,,,,,,,,,,,,,
birds,Corvus caurinus,Northwestern crow,anecdotal,pry,pry_access,pry peanut from crack with stick in perch,tooling,allocentric,1,stick to peanut,dynamic,,no,,no,,Jewett 1924,1,42,Report of King's observations. Seen in only one captive animal,,,,,,,,,,,,,,,,,,,,,,,,,,,,,,,,,,,,,,,,,,,,,,,,,,,,,,,,
birds,Corvus corax,Northern raven,,drop,drop_threat,drop stones on intruders,IOU,,,,,,,,,,,,38,,,,,,,,,,,,,,,,,,,,,,,,,,,,,,,,,,,,,,,,,,,,,,,,,,,,,,,,,
birds,Corvus corax,northern raven,,drop,drop_threat,drop grass on nesting birds (to harrass to access eggs?),IOU,,,,,,,,,,,,38,,,,,,,,,,,,,,,,,,,,,,,,,,,,,,,,,,,,,,,,,,,,,,,,,,,,,,,,,
birds,Corvus corax,Raven,,affix,place_hide,cover stored food with debris,IOU,,,,,,,,,,,,52,,,,,,,,,,,,,,,,,,,,,,,,,,,,,,,,,,,,,,,,,,,,,,,,,,,,,,,,,
birds,Corvus cornix,Hooded crow,,drop,drop_threat,drop twigs on intruders,IOU,,,,,,,,,,,,37,,,,,,,,,,,,,,,,,,,,,,,,,,,,,,,,,,,,,,,,,,,,,,,,,,,,,,,,,
birds,Corvus frugilegus,Rook,,affix,wipe_selfanoint,"apply smoke/embers to plumage (a type of ""anting""?)",IOU,,,,,,,,,,,,50-51,,,,,,,,,,,,,,,,,,,,,,,,,,,,,,,,,,,,,,,,,,,,,,,,,,,,,,,,,
birds,Corvus frugilegus,Rook,,block,block_flood,put plug in drain hole,IOU,,,,,,,,,,,,48-49,,,,,,,,,,,,,,,,,,,,,,,,,,,,,,,,,,,,,,,,,,,,,,,,,,,,,,,,,
birds,Corvus frugilegus,Rook,,drop,drop_access,drop stones/sticks to collapse platform to access reward,IOU,,,,,,,,,,,,38,Can do so sequentially in the lab (considered by Shumaker sequential tool use),,,,,,,,,,,,,,,,,,,,,,,,,,,,,,,,,,,,,,,,,,,,,,,,,,,,,,,,
birds,Corvus frugilegus,Rook,,drop,drop_raise,drop stones to raise water level to access floating reward,IOU,,,,,,,,,,,,38,,,,,,,,,,,,,,,,,,,,,,,,,,,,,,,,,,,,,,,,,,,,,,,,,,,,,,,,,
birds,Corvus frugilegus,Rook,experimental,probe,reach_access,probe into tube with twig/hook for reward in bucket,tooling,allocentric,1,stick/hook to reward,dynamic,,yes,1,no,,Bird & Emery 2009,1,47,Bent wire into hooks.,,,,,,,,,,,,,,,,,,,,,,,,,,,,,,,,,,,,,,,,,,,,,,,,,,,,,,,,
birds,Corvus moneduloides,New Caledonian crow,observational,dig,probe_access,probe through loose substrate with stems,tooling,allocentric,1,stem to substrate,dynamic,,no,,no,,Rutz et al. 2007,1,42,Travel with/re-use tools,,,,,,,,,,,,,,,,,,,,,,,,,,,,,,,,,,,,,,,,,,,,,,,,,,,,,,,,
birds,Corvus moneduloides,New Caledonian crow,observational/experimental,probe,probe_access,probe holes/crevices/under debris with sticks/stems/Pandanus hook tools,tooling,allocentric,1,stick to hole,dynamic,,yes, 1-3,no,,"Chappell & Kacelnik 2002; Cunisset 1909 in Hunt 2000; Hanne?cart and Le?tocart 1980 in Hunt 2000; Holzhaider et al. 2008; Hunt 1996, 2000a, 2000b; Hunt & Gray 2002, 2003, 2004a, 2004b, 2006, 2007; Hunt, Lambert & Gray, 2007; Hunt, Rutledge & Gray 2006; Kenward et al. 2005, 2006; Le Goupils 1928 in Hunt 2000; Orenstein 1972; Rutledge & Hunt 2004; Taylor et al. 2009; Troscianko, Bluff & Rutz 2008; Weir, Chappell & Kacelnik, 2002; Weir et al. 2004",24,44-47,"carry tools from stop to stop. Selective in tool material selection. Hook tools multiple manufacture steps (detach at fork, sculpt, remove any leaves and sharpen hook; qualify as ""tool Crafting"" by Shumaker), Pandanus tools multiple steps as well (detach, then cut w/ steps to a point; fold into ""boomerang"" shape); also remove twiglet protrusions after detaching a stick. Evidence that disposition, social learning and trial-and-error learning are important. tool manufacture/innovation seen in the lab. sequential tool use seen in lab.",,,,,,,,,,,,,,,,,,,,,,,,,,,,,,,,,,,,,,,,,,,,,,,,,,,,,,,,
birds,Corvus ossifragus,Fish crow,,drop,drop_threat,drop grass on nesting birds (to harrass to access eggs?),IOU,,,,,,,,,,,,38,,,,,,,,,,,,,,,,,,,,,,,,,,,,,,,,,,,,,,,,,,,,,,,,,,,,,,,,,
birds,Corvus rhipidurus,Fan-tailed raven,,drag,throw_open,"flip a stone over an ""egg"" (actually a ping pong ball)",IOU,,,,,,,,,,,,39,,,,,,,,,,,,,,,,,,,,,,,,,,,,,,,,,,,,,,,,,,,,,,,,,,,,,,,,,
birds,Corvus rhipidurus,Fan-tailed raven,anecdotal,pound,hammer_open,"hammer on ""egg"" with rock (actually a ping pong ball)",tooling,allocentric,1,"rock to ""egg""",dynamic,,no,,no,,Andersson 1989,1,41,Seen in only one animal,,,,,,,,,,,,,,,,,,,,,,,,,,,,,,,,,,,,,,,,,,,,,,,,,,,,,,,,
birds,Corvus splendens,Indian house crow,anecdotal,probe,fish_access,probe cavity with leaf to extract ants,tooling,allocentric,1,leaf to cavity,dynamic,,no,,no,,Rajan & Balasubramanian 1989,1,47,Seen in only one animal,,,,,,,,,,,,,,,,,,,,,,,,,,,,,,,,,,,,,,,,,,,,,,,,,,,,,,,,
birds,Cyanistes caeruleus,Blue tit,anecdotal,probe,probe_access,probe nut hopper with twig,tooling,allocentric,1,twig to nut hopper,dynamic,,no,,no,,Boswall 1977 (pers. Comm),1,44,Pers. comm by M. Coombes. Seen in only one animal.,,,,,,,,,,,,,,,,,,,,,,,,,,,,,,,,,,,,,,,,,,,,,,,,,,,,,,,,
birds,Cyanocitta cristata,Blue jay,,drop,drop_raise,drop debris to raise water to drinking level,IOU,,,,,,,,,,,,38,,,,,,,,,,,,,,,,,,,,,,,,,,,,,,,,,,,,,,,,,,,,,,,,,,,,,,,,,
birds,Cyanocitta cristata,Blue jay,experimental,reach,reach_access,rake in pellets with paper/other objects,tooling,allocentric,1,Paper to pellet,dynamic,,yes,1,no,,Jones & Kamil 1973,1,43,"Authors believe only one jay spontaneously innovated tool use, and that the others tested afteward learned by observation.",,,,,,,,,,,,,,,,,,,,,,,,,,,,,,,,,,,,,,,,,,,,,,,,,,,,,,,,
birds,Cyanocitta cristata,Blue jay,anecdotal,wipe,wipe_access,wipe food bowl with wetted paper,tooling,allocentric,1,Paper to bowl,dynamic,,yes,1,no,,Jones & Kamil 1973,1,50,Seen in only one captive animal,,,,,,,,,,,,,,,,,,,,,,,,,,,,,,,,,,,,,,,,,,,,,,,,,,,,,,,,
birds,Cyanocitta stelleri,Steller’s jay,anecdotal,jab,jab_threat,thrust at at crow with stick,tooling,allocentric,1,stick to crow,dynamic,,yes,1,no,,Balda 2007,1,43,Seen in only one animal,,,,,,,,,,,,,,,,,,,,,,,,,,,,,,,,,,,,,,,,,,,,,,,,,,,,,,,,
birds,Cyanocorax luxuosus,Green jay,anecdotal,probe,probe_access,probe under bark with twig  for prey,tooling,allocentric,1,twig to bark,dynamic,,no,,no,,Gayou 1982,1,47,Seen in 2/14 animals.,,,,,,,,,,,,,,,,,,,,,,,,,,,,,,,,,,,,,,,,,,,,,,,,,,,,,,,,
birds,Cyanocorax luxuosus,Green jay,anecdotal,pry,pry_remove,pry off pieces of bark with twig (to consume insects),tooling,allocentric,1,twig to bark,dynamic,,no,,no,,Gayou 1982,1,42,Seen in only one animal,,,,,,,,,,,,,,,,,,,,,,,,,,,,,,,,,,,,,,,,,,,,,,,,,,,,,,,,
birds,Cyanoramphus auriceps,Yellow-crowned parakeets,experimental,reach,reach_access,rake in seeds with twig,tooling,allocentric,1,twig to seeds,dynamic,,no,,no,,Funk 2002,1,43,Performed poorly when rake not already positioned with the reward inside,,,,,,,,,,,,,,,,,,,,,,,,,,,,,,,,,,,,,,,,,,,,,,,,,,,,,,,,
birds,Daphoenositta chrysoptera,Varied sittellas,anecdotal,probe,probe_access,probe cavity with wood strip for larvae,tooling,allocentric,1,wood to cavity,dynamic,,no,,no,,Green 1972,1,47,Seen in only one animal.,,,,,,,,,,,,,,,,,,,,,,,,,,,,,,,,,,,,,,,,,,,,,,,,,,,,,,,,
birds,Eclectus roratus,Eclectus parrot,anecdotal,dig,dig_burrow,excavate sand-gravel with palm frond for burrow,tooling,allocentric,1,frond to sand,dynamic,,no,,no,,DeCourcey (pers. Comm),1,42,Seen in only one captive animal,,,,,,,,,,,,,,,,,,,,,,,,,,,,,,,,,,,,,,,,,,,,,,,,,,,,,,,,
birds,Euphagus cyanocephalus,Brewer’s blackbird,,absorb,place_absorb,dip grasshoppers to absorb water to feed nestlings,IOU,,,,,,,,,,,,50,,,,,,,,,,,,,,,,,,,,,,,,,,,,,,,,,,,,,,,,,,,,,,,,,,,,,,,,,
birds,Eurypyga helias,Sunbittern,,bait,bait_hunt,place food on water as  bait for fish,IOU,,,,,,,,,,,,40,,,,,,,,,,,,,,,,,,,,,,,,,,,,,,,,,,,,,,,,,,,,,,,,,,,,,,,,,
birds,Eurystomus glaucurus,Broad-billed roller,,bait,bait_courtship,use objects (typically used as gizzard stones) as a courtship display,IOU,,,,,,,,,,,,41,,,,,,,,,,,,,,,,,,,,,,,,,,,,,,,,,,,,,,,,,,,,,,,,,,,,,,,,,
birds,Falcunculus frontatus,Crested shriketit,anecdotal,probe,probe_access,probe in crevice with twig for prey,tooling,allocentric,1,twig to crevice,dynamic,,yes,1,no,,Noske 1985; Richards 1971,2,44,Seen in only one animal in each report (two total),,,,,,,,,,,,,,,,,,,,,,,,,,,,,,,,,,,,,,,,,,,,,,,,,,,,,,,,
birds,Galliform spp.,Gamefowl,,affix,wipe_selfanoint,"apply ants to plumage (""anting"")",IOU,,,,,,,,,,,,50,,,,,,,,,,,,,,,,,,,,,,,,,,,,,,,,,,,,,,,,,,,,,,,,,,,,,,,,,
birds,Garrulus glandarius,Eurasian jay,,affix,wipe_selfanoint,"apply smoke/embers to plumage (a type of ""anting""?)",IOU,,,,,,,,,,,,51,,,,,,,,,,,,,,,,,,,,,,,,,,,,,,,,,,,,,,,,,,,,,,,,,,,,,,,,,
birds,Geospiza conirostris,Española cactus finch,experimental,probe,probe_access,probe in cracks with twig for prey,tooling,allocentric,1,twig to crack,dynamic,,no,,no,,Millikan & Bowman 1967,1,43,Seen in only one captive animal; caged next to woodpecker finches where able to observe their tool use,,,,,,,,,,,,,,,,,,,,,,,,,,,,,,,,,,,,,,,,,,,,,,,,,,,,,,,,
birds,Grus canadensis,Sandhill crane,anecdotal,wipe,wipe_autogroom,wipe with towel to dry after swimming,tooling,egocentric,1,towel to body,dynamic,,no,,no,,Bartlett & Bartlett 1973,1,50,Seen in only one captive animal,,,,,,,,,,,,,,,,,,,,,,,,,,,,,,,,,,,,,,,,,,,,,,,,,,,,,,,,
birds,Haematopus ostralegus,Eurasian oystercatcher,anecdotal,probe,probe_access,probe crevice with stick  for prey,tooling,allocentric,1,stick to crevice,dynamic,,no,,no,,Olney in Boswall 1978,1,44,Seen in only one captive (zoo) animal on multiple occasions.,,,,,,,,,,,,,,,,,,,,,,,,,,,,,,,,,,,,,,,,,,,,,,,,,,,,,,,,
birds,Haliaeetus leucocephalus,Bald eagle,anecdotal,club,club_hunt,club turtle with stick in beak,tooling,allocentric,1,stick to turtle,dynamic,,no,,no,,Bindner 1968,1,41,Seen in only one captive animal,,,,,,,,,,,,,,,,,,,,,,,,,,,,,,,,,,,,,,,,,,,,,,,,,,,,,,,,
birds,Haliaeetus leucocephalus,Bald eagle,anecdotal,pound,club_hunt,hammer prey with rock,tooling,allocentric,1,rock to prey,dynamic,,no,,no,,Bindner 1968,1,41,Seen in only one captive animal,,,,,,,,,,,,,,,,,,,,,,,,,,,,,,,,,,,,,,,,,,,,,,,,,,,,,,,,
birds,Haliaeetus leucocephalus,Bald eagle,,throw,drop_hunt,throw stone at prey,IOU,,,,,,,,,,,,38,,,,,,,,,,,,,,,,,,,,,,,,,,,,,,,,,,,,,,,,,,,,,,,,,,,,,,,,,
birds,Haliaeetus leucocephalus,Bald eagle,,throw,throw_attention,throw stone at objects (to get attention),IOU,,,,,,,,,,,,38,,,,,,,,,,,,,,,,,,,,,,,,,,,,,,,,,,,,,,,,,,,,,,,,,,,,,,,,,
birds,Hamirostra melanosternon,Black-breasted buzzard,,drop,drop_open,drop stones to break emu eggs,IOU,,,,,,,,,,,,37,,,,,,,,,,,,,,,,,,,,,,,,,,,,,,,,,,,,,,,,,,,,,,,,,,,,,,,,,
birds,Hamirostra melanosternon,Black-breasted buzzard,,throw,throw_open,throw stones to break eggs,IOU,,,,,,,,,,,,38,,,,,,,,,,,,,,,,,,,,,,,,,,,,,,,,,,,,,,,,,,,,,,,,,,,,,,,,,
birds,Laridae spp.,Gulls/ terns,,affix,place_unknown,place stone in nest (when only two eggs instead of three - to make incubation more comfortable?),IOU,,,,,,,,,,,,52,,,,,,,,,,,,,,,,,,,,,,,,,,,,,,,,,,,,,,,,,,,,,,,,,,,,,,,,,
birds,Larus argentatus,Herring gull,,bait,bait_hunt,place food on water as  bait for fish,IOU,,,,,,,,,,,,40,,,,,,,,,,,,,,,,,,,,,,,,,,,,,,,,,,,,,,,,,,,,,,,,,,,,,,,,,
birds,Larus fuscus,Lesser black-backed gull,,bait,bait_hunt,place food on water as  bait for fish,IOU,,,,,,,,,,,,40,,,,,,,,,,,,,,,,,,,,,,,,,,,,,,,,,,,,,,,,,,,,,,,,,,,,,,,,,
