group,latin_name,species,support,mode,submode,description,tooling_or_IOU,frame_of_reference,number_relations,temporal_order,1_dynamic_relation,2_dynamic_relation,manufacture,steps_manufacture,associative,type_associative,reference,total_references,page,comments,,,,,,,,,,,,,,,,,,,,,,,,,,,,,,,,,,,,,,,,,,,,,,,,,,,,,,,,
great apes,Pan troglodytes,Chimpanzee,observational/experimental,probe,insert_unlock,"open/attempt to open locks with keys/sticks/other objects, including series of locks",tooling,allocentric,1,key to lock,dynamic,,yes,1,yes,sequential,"Bingham 1929; Döhl 1968; Fletcher & Weghorst 2005; Furness 1916; Jennison 1927; McGrew, Tutin & Midgett 1975; Menzel, Davenport, & Rogers 1970; Schastnyi 1963, 1972; Temerlin 1975",10,"170,190",sequential use of keys to open locked boxes. One captive detached splinters to use as lock pick.,,,,,,,,,,,,,,,,,,,,,,,,,,,,,,,,,,,,,,,,,,,,,,,,,,,,,,,,
great apes,Pan troglodytes,Chimpanzee,anecdotal,probe,probe_access,extract mushrooms from inside a mound with a stick,tooling,allocentric,1,stick to mound,dynamic,,no,,no,,Boesch 1995,1,168,,,,,,,,,,,,,,,,,,,,,,,,,,,,,,,,,,,,,,,,,,,,,,,,,,,,,,,,,
great apes,Pan troglodytes,Chimpanzee,observational,probe,probe_access,extract marrow from bones/meat from nuts using sticks/stems,tooling,allocentric,1,stick to bone,dynamic,,yes, 1-3,no,,"Boesch & Boesch 1989, 1990; Sanz & Morgan 2007",3,"169,195","Detach twigs/shorten, remove side branches/leaves, sharpen end to make ""marrow-picks."" See pound for associative use/tool set for extracting nut after cracking.",,,,,,,,,,,,,,,,,,,,,,,,,,,,,,,,,,,,,,,,,,,,,,,,,,,,,,,,
great apes,Pan troglodytes,Chimpanzee,observational/experimental,probe,probe_access,use sticks/rods/objects to get foods from containers,tooling,allocentric,1,stick to container,dynamic,,yes, 1-2,no,,"Boesch 1981; Bettinger & Carter 1991; Bodamer 1990; Brandibas, Chalmeau & Gallo 1995; Cantalupo et al. 2008; Celli, Hirata & Tomonaga 1999, 2004; Celli et al. 2001; Fletcher & Weghorst 2005; Gaspar & Reis 1993; Harvey 1998; Hirata 2006; Hirata & Celli 2003; Hirata & Morimura 2000; Hopkins & Rabinowitz 1997; Hopkins, Russell & Cantalupo 2007; Köhler 1925; Ladygina- Kohts 1959, 2002; Lonsdorf et al 2009; Maki et al 1989; Morimura 2003; Morimura et al. 2002; Ochiai & Matsuzawa 1998; Murphy 1976; Nash 1981, 1982; Paquette 1992, 1994; Perret, Buechner & Adler 1998; Pfeiffer & Koebner 1978; Poulson 1974-1975; Terdal 2005; Tonooka 1994; Vancatova 2008; Wehnelt, Bird & Lenihan 2006",36,"170,190,192",Sometimes detach tools for use and/or remove leaves/side branches.,,,,,,,,,,,,,,,,,,,,,,,,,,,,,,,,,,,,,,,,,,,,,,,,,,,,,,,,
great apes,Pan troglodytes,Chimpanzee,observational,probe,probe_allogroom,clean/remove others teeth with sticks/cloth,tooling,allocentric,1,stick to teeth,dynamic,,yes, 1-2,no,,"McGrew & Tutin 1972, 1973; King, Stevens & Mellen 1980; Vancatova pers comm",4,170,Strip leaves/shorten twigs.,,,,,,,,,,,,,,,,,,,,,,,,,,,,,,,,,,,,,,,,,,,,,,,,,,,,,,,,
great apes,Pan troglodytes,Chimpanzee,anecdotal,probe,probe_autogroom,clean ears with stick,tooling,egocentric,1,stick to ear,dynamic,,no,,no,,Nissen 1956,,170,Seen in only one captive animal.,,,,,,,,,,,,,,,,,,,,,,,,,,,,,,,,,,,,,,,,,,,,,,,,,,,,,,,,
great apes,Pan troglodytes,Chimpanzee,anecdotal,probe,probe_autogroom,probe nostril with stick to clear mucous,tooling,egocentric,1,stick to nostril,dynamic,,yes,1,no,,Marchant & McGrew 1999; Nishida & Nakamura 1993,2,"169,192",Seen in two wild animals. One removed leaves from twig/ leaf blade from leaf.,,,,,,,,,,,,,,,,,,,,,,,,,,,,,,,,,,,,,,,,,,,,,,,,,,,,,,,,
great apes,Pan troglodytes,Chimpanzee,observational,probe,probe_autogroom,clean own teeth with sticks,tooling,egocentric,1,stick to teeth,dynamic,,yes, 1-2,no,,"Brewer 1978; King, Stevens & Mellen 1980; McGrew & Tutin 1972, 1973; Vancatova pers comm",5,170,Strip leaves/shorten twigs.,,,,,,,,,,,,,,,,,,,,,,,,,,,,,,,,,,,,,,,,,,,,,,,,,,,,,,,,
great apes,Pan troglodytes,Chimpanzee,,probe,probe_explore,probe crevices with sticks/other objects,IOU,,,,,,,,,,,,170,Borderline case (aim is unclear).,,,,,,,,,,,,,,,,,,,,,,,,,,,,,,,,,,,,,,,,,,,,,,,,,,,,,,,,
great apes,Pan troglodytes,Chimpanzee,,probe,probe_explore,insert sticks/stalks/other tools into cavities for olfactory information,IOU,,,,,,,,,,,,169,Borderline case.,,,,,,,,,,,,,,,,,,,,,,,,,,,,,,,,,,,,,,,,,,,,,,,,,,,,,,,,
great apes,Pan troglodytes,Chimpanzee,experimental,probe,push_access,"insert a stick/pole to push food out of a tube (""tube task"" / ""box-and-stick problem"")",tooling,allocentric,1,stick to food,dynamic,,yes,1,no,,"Bania et al. 2009; Bard, Fragaszy & Visalberghi 1995; Birch 1945; Greenfield & Savage-Rumbaugh 1984; Haggerty 1910; Hayes & Hayes 1952; Hayes & Nissen 1971; Hobhouse 1926; Hopper et al. 2007; Horner & Whiten 2005, 2007; Ladygina-Kohts 1959; Ladygina-Kohts & Dembovskii 1969; Khroustov 1964; Limongelli, Boysen & Visalberghi 1995; Martin-Ordas, Call & Colmenares 2008; Marshall-Pescini & Whiten 2008; Mulcahy & Call 2006; Osvath & Osvath 2008; Pescetta et al. 2008; Povinelli et al. 2000; Savage-Rumbaugh, Rumbaugh & Boysen 1978; Savage-Rumbaugh 1986; Savage-Rumbaugh, Rumbaugh & Boysen 1978; Seed et al 2009; Tonooka, Tomonaga & Matsuzawa 1997; Visalberghi, Fragaszy, and Savage-Rumbaugh 1995; Whiten, Horner & de Waal 2005; Whiten et al. 2007; Yerkes 1943; Yerkes & Learned 1925; Yerkes & Yerkes 1929",32,"170-171,192,195","Modified tools including removing leaves, removing crosspieces and bending/unbending wires. One captive broke pieces of wood along grain to create tools. Did not include trap-tube (included in reach)",,,,,,,,,,,,,,,,,,,,,,,,,,,,,,,,,,,,,,,,,,,,,,,,,,,,,,,,
great apes,Pan troglodytes,Chimpanzee,observational,probe,scoop_access, scoop out water from cavities with leaves/grass blades/sticks/other objects,tooling,allocentric,1,leaf to cavity,dynamic,,yes,1,no,,Goodall 1964; Kummer & Goodall 1985; Matsuzawa 1991; McGrew 1977; Ohashi 2006; Sugiyama 1995; Sugiyama & Koman 1979; Tonooka 2001; van Lawick–Goodall 1968,9,"169,190,196",Sometimes detach tools for use or chew leaf/ends of sticks into sponges.,,,,,,,,,,,,,,,,,,,,,,,,,,,,,,,,,,,,,,,,,,,,,,,,,,,,,,,,
great apes,Pan troglodytes,Chimpanzee,,prop,prop_access,place boxes/objects under out of reach rewards,IOU,,,,,,,,,,,,173,,,,,,,,,,,,,,,,,,,,,,,,,,,,,,,,,,,,,,,,,,,,,,,,,,,,,,,,,
great apes,Pan troglodytes,Chimpanzee,,prop,prop_access,stack boxes to reach out of reach reward,IOU,,,,,,,,,,,,174,,,,,,,,,,,,,,,,,,,,,,,,,,,,,,,,,,,,,,,,,,,,,,,,,,,,,,,,,
great apes,Pan troglodytes,Chimpanzee,,prop,prop_locomote,prop logs/ladders/other objects to climb,IOU,,,,,,,,,,,,172-173,,,,,,,,,,,,,,,,,,,,,,,,,,,,,,,,,,,,,,,,,,,,,,,,,,,,,,,,,
great apes,Pan troglodytes,Chimpanzee,,prop,prop_locomote,insert sticks/branches into fencing as pitons to climb,IOU,,,,,,,,,,,,172,,,,,,,,,,,,,,,,,,,,,,,,,,,,,,,,,,,,,,,,,,,,,,,,,,,,,,,,,
great apes,Pan troglodytes,Chimpanzee,,prop,prop_locomote,balance poles to climb/jump,IOU,,,,,,,,,,,,173,,,,,,,,,,,,,,,,,,,,,,,,,,,,,,,,,,,,,,,,,,,,,,,,,,,,,,,,,
great apes,Pan troglodytes,Chimpanzee,,prop,prop_locomote,place pole between barges to travel across,IOU,,,,,,,,,,,,173-174,,,,,,,,,,,,,,,,,,,,,,,,,,,,,,,,,,,,,,,,,,,,,,,,,,,,,,,,,
great apes,Pan troglodytes,Chimpanzee,,prop,prop_locomote,reposition conspecifics to climb on them,IOU,,,,,,,,,,,,173,,,,,,,,,,,,,,,,,,,,,,,,,,,,,,,,,,,,,,,,,,,,,,,,,,,,,,,,,
great apes,Pan troglodytes,Chimpanzee,,prop,prop_otherlocomote,"hold branch in place so infant can cross (""bridging')",IOU,,,,,,,,,,,,173,,,,,,,,,,,,,,,,,,,,,,,,,,,,,,,,,,,,,,,,,,,,,,,,,,,,,,,,,
great apes,Pan troglodytes,Chimpanzee,,prop,prop_rest,use tire as support for body,IOU,,,,,,,,,,,,173,,,,,,,,,,,,,,,,,,,,,,,,,,,,,,,,,,,,,,,,,,,,,,,,,,,,,,,,,
great apes,Pan troglodytes,Chimpanzee,observational,pry,pry_access,pry open boxes/feeders/doors with tools,tooling,allocentric,1,tool to box,dynamic,,yes,2,no,,"Goodall 1964, 1986; Hobhouse 1926; Köhler 1925; Kollar 1972; Kummer & Goodall 1985; van Lawick–Goodall 1968, 1970, 1971; McGrew, Tutin & Midgett 1975; Wrangham 1974",11,"157,191,193","Boxes were provisioning for wild animals. Detached sticks and removed leaves, or reshaped splinters to make sharp edge.",,,,,,,,,,,,,,,,,,,,,,,,,,,,,,,,,,,,,,,,,,,,,,,,,,,,,,,,
great apes,Pan troglodytes,Chimpanzee,observational,pry,pry_enlarge,"open/widen spaces with sticks to access nests (""lever open"")",tooling,allocentric,1,stick to opening,dynamic,,yes,1,no,,"Bermejo & Illera 1999; Boesch & Boesch 1990; Boesch, Head & Robbins 2009; Brewer & McGrew 1990; Fay & Carroll 1994; Goodall 1986; Sanz & Morgan 2007; Teleki 1974; Tutin, Ham & Wrogemann 1995; van Lawick–Goodall 1968, 1970, 1971, 1973; Watts 2008; Whiten et al. 1999",15,"156-157,189","Often used/made after pounding something open, sometimes same tool as used for pounding. See pound for associative tool use involving pounding open hive then widening the hole.",,,,,,,,,,,,,,,,,,,,,,,,,,,,,,,,,,,,,,,,,,,,,,,,,,,,,,,,
great apes,Pan troglodytes,Chimpanzee,anecdotal,pry,pry_remove,lever a tree out of the way by placing stick in crack between two trees,tooling,allocentric,1,stick to tree,dynamic,,no,,no,,"Takeshita & van Hooff 1996, 2001",2,157,Seen in two captive animals.,,,,,,,,,,,,,,,,,,,,,,,,,,,,,,,,,,,,,,,,,,,,,,,,,,,,,,,,
great apes,Pan troglodytes,Chimpanzee,anecdotal,pry,pry_remove,use a knife to remove plaster from walls,tooling,allocentric,1,knife to wall,dynamic,,no,,no,,Ladygina-Kohts 2002,1,157,Aim unclear. Seen in one captive animal.,,,,,,,,,,,,,,,,,,,,,,,,,,,,,,,,,,,,,,,,,,,,,,,,,,,,,,,,
great apes,Pan troglodytes,Chimpanzee,,pry,pry_unknown,pry in crevices with sticks (in exploration? Frustration?),IOU,,,,,,,,,,,,157,Borderline case (aim is unclear).,,,,,,,,,,,,,,,,,,,,,,,,,,,,,,,,,,,,,,,,,,,,,,,,,,,,,,,,
great apes,Pan troglodytes,Chimpanzee,anecdotal,reach,brush_allogroom,brush a doll's hair with a hairbrush,tooling,allocentric,1,brush to hair,dynamic,,no,,no,,Mignault 1985,1,164,Seen in only one human-reared animal. Likely from observing humans.,,,,,,,,,,,,,,,,,,,,,,,,,,,,,,,,,,,,,,,,,,,,,,,,,,,,,,,,
great apes,Pan troglodytes,Chimpanzee,anecdotal,reach,brush_autogroom,brush own hair with a comb,tooling,egocentric,1,brush to hair,dynamic,,no,,no,,Vancatova pers comm,1,164,Pers comm.,,,,,,,,,,,,,,,,,,,,,,,,,,,,,,,,,,,,,,,,,,,,,,,,,,,,,,,,
great apes,Pan troglodytes,Chimpanzee,observational,reach,probe_allogroom,use twig to probe conspecific/human body,tooling,allocentric,1,stick to mother,dynamic,,yes,1,no,,Fouts 1983; Kummer & Goodal 1985; Merfield 1956,3,164,tool manufacture of probe by one experimental chimp (Loulis).,,,,,,,,,,,,,,,,,,,,,,,,,,,,,,,,,,,,,,,,,,,,,,,,,,,,,,,,
great apes,Pan troglodytes,Chimpanzee,anecdotal,reach,probe_autogroom,use twig to probe under toenail for flea,tooling,egocentric,1,stick to self,dynamic,,yes,1,no,,Nishida 2002; Nishida et al. 2009,2,164,Seen in two wild females. One detached tool for use.,,,,,,,,,,,,,,,,,,,,,,,,,,,,,,,,,,,,,,,,,,,,,,,,,,,,,,,,
great apes,Pan troglodytes,Chimpanzee,anecdotal,reach,pull_autogroom,use pliers to extract molar from own mouth,tooling,egocentric,1,pliers to molar,static,,no,,no,,Hayes & Hayes 1954,1,164,Seen in only one experimental animal (Viki),,,,,,,,,,,,,,,,,,,,,,,,,,,,,,,,,,,,,,,,,,,,,,,,,,,,,,,,
great apes,Pan troglodytes,Chimpanzee,observational,reach,reach_access,rake in ants with stick/stalk,tooling,allocentric,1,stick to ant,dynamic,,no,,no,,"Köhler 1925; McGrew et al. 2003; Sugiyama, Koman & Sow 1988",3,161-162,,,,,,,,,,,,,,,,,,,,,,,,,,,,,,,,,,,,,,,,,,,,,,,,,,,,,,,,,
great apes,Pan troglodytes,Chimpanzee,anecdotal,reach,reach_access,"pull in an out of reach fruiting branch using a stick (""branch hauling""/""branch-hook"")",tooling,allocentric,1,stick to branch,dynamic,,yes,1,no,,Sugiyama & Koman 1979; Whiten et al. 1999,2,161,Seen in only one wild individual. Detached stick for use.,,,,,,,,,,,,,,,,,,,,,,,,,,,,,,,,,,,,,,,,,,,,,,,,,,,,,,,,
great apes,Pan troglodytes,Chimpanzee,observational/experimental,reach,reach_access,pull in algae/vegetation/objects from the water using a stem/other objects,tooling,allocentric,1,stem to algae,dynamic,,yes, 1-2,no,,"Devos, Gatti & Levréro 2002; Fletcher & Weghorst 2005; Goustard 1986; Kollar 1972; Matsuzawa 1999; Matsuzawa, Yamakoshi & Humle 1996; Ohashi 2006; van Hooff 1973; Whiten et al. 1999; Yamakoshi 1998",10,"161,189,191","Wild chimps detach, strip stems/trim off head and/or remove leaves before use. carry tool between pools.",,,,,,,,,,,,,,,,,,,,,,,,,,,,,,,,,,,,,,,,,,,,,,,,,,,,,,,,
great apes,Pan troglodytes,Chimpanzee,observational/experimental,reach,reach_access,reach/rake in objects/food with stick/rakes/poles/other objects,tooling,allocentric,1,stick to object,dynamic,,yes, 1-2,yes,sequential,"Bania et al. 2009; Birch 1945; Bourne 1971; Brent, Bloomsmith & Fisher 1995; Chamove 1989; de Waal 2007; Denisov 1958 in Windholz 1984; Do?hl 1966, 1969; Dufour & Sterck 2008; Firsov 1972, 1982; Fletcher & Weghorst 2005; Girndt, Meier & Call 2008; Goustard 1986; Guillaume & Meyerson 1930, 1934; Hayes 1951; Hayes & Hayes 1952; Hobhouse 1926; Hrubesch, Preuschoft & van Schaik 2009; Jackson 1942; Jacobsen, Wolfe & Jackson 1935; Jennison 1927; Jones 1986; Kats 1972; King, Stevens & Mellen 1980; Ko?hler 1925; Kollar 1972; Ladygina-Kohts 2002; Levyki 1959 in Ladygina- Kohts & Dembovskii 1969; Mathieu et al. 1980; Menzel, Davenport & Rogers 1970; Nagell, Olguin & Tomasello 1993; Nissen 1956; Novoselova 1959 in Ladygina-Kohts & Dembovskii 1969; Okano et al. 1973; Poulsen 1974–1975; Povinelli et al. 2000; Prince et al. 2009; Roginskii 1945 in Ladygina-Kohts & Dembovskii 1969; Rothmann & Teuber in Bierens de Haan 1931; Savage-Rumbaugh 1986; Schiller 1952, 1957; Takeshita & van Hooff 1996, 2001; Temerlin 1975; Tomasello et al. 1987; van Hooff 1973",50,"162-163,189,191-194,198,201","Varying levels of difficulty (e.g. detours, functio l/nonfunctio l tool choice). Does not count tasks in which rake is pre-positioned as tool use (incl many trap tube tasks). sequential studies of getting progressively longer tools (up to four). Sometimes detach tools for use. Some studies joined sticks together to make longer sticks (in one bit pieces from boards to insert into hollow sitcks). Some chimps bent straw clumps to make firm reaching tools, and uncoiled wire. One study modified an H-shaped stick to fit in tube (but also many errors made). One study required substraction to make a hook tool. Composite tool: place sponge into hole of water, then pull out with stick. There are a number of studies in which chimpanzees failed in reaching tasks (CF Birch 1945, Haggerty 1910, Mathieu & Bergeron 1977, Parker 1968, 1969, Povinelli et al. 2000, Schiller 1957; Shepherd 1923 - age, social history and rearing enviro history considered factors in failure)",,,,,,,,,,,,,,,,,,,,,,,,,,,,,,,,,,,,,,,,,,,,,,,,,,,,,,,,
great apes,Pan troglodytes,Chimpanzee,anecdotal,reach,reach_dislodge,knock fruit with a stick out of a human's hands,tooling,allocentric,1,stick to fruit,dynamic,,yes,3,no,,van Lawick-Goodall 1968,1,"161,189,191","Seen in only one wild individual. Did not succeed. Detached stick, removed thorny bark and side branches for use.",,,,,,,,,,,,,,,,,,,,,,,,,,,,,,,,,,,,,,,,,,,,,,,,,,,,,,,,
great apes,Pan troglodytes,Chimpanzee,observational/experimental,reach,reach_explore,touch frightening objects with stick/stem at distance,tooling,allocentric,1,stick to object,static,,no,,no,,"Boesch & Boesch 1990; Brewer & Brewer in van Lawick–Goodall 1973; Brink 1957; Dunnett & Albrecht 1971; Goodall 1986; Köhler 1925; Kortlandt & Kooij 1963; Menzel 1971; Mottershead 1959, 1963; Ohashi 2006; van Lawick–Goodall 1968, 1970, 1971, 1973; Wilson & Wilson in McGrew, Tutin, and Midgett 1975",16,"163-164,189",Borderline. Often smell the end of the stick after probing. Detached tools for use.,,,,,,,,,,,,,,,,,,,,,,,,,,,,,,,,,,,,,,,,,,,,,,,,,,,,,,,,
great apes,Pan troglodytes,Chimpanzee,anecdotal,reach,reach_extinguish,extinguish flame with object,tooling,allocentric,1,object to flame,static,,no,,no,,Denisov 1958 / Orbeli 1949 in Windholz 1984,2,164,Seen in only one captive animal.,,,,,,,,,,,,,,,,,,,,,,,,,,,,,,,,,,,,,,,,,,,,,,,,,,,,,,,,
great apes,Pan troglodytes,Chimpanzee,anecdotal,reach,reach_press,use a stick to flip an out of reach light switch on and off,tooling,allocentric,1,,static,,no,,no,,Nissen 1956,1,162,Seen in only one captive animal.,,,,,,,,,,,,,,,,,,,,,,,,,,,,,,,,,,,,,,,,,,,,,,,,,,,,,,,,
great apes,Pan troglodytes,Chimpanzee,observational,reach,scratch_autogroom,use twig/straw/object to reach body parts for grooming,tooling,egocentric,1,stick to self,dynamic,,no,,no,,"van Lawick-Goodall 1970, 1971; Merfield 1956; Sanz & Morgan 2007; Reynolds and Assersohn in Whiten et al 1999; Temerlin 1975",6,164,,,,,,,,,,,,,,,,,,,,,,,,,,,,,,,,,,,,,,,,,,,,,,,,,,,,,,,,,
great apes,Pan troglodytes,Chimpanzee,experimental,reach,screw_unknown,extract screws using screwdriver for unknown reasons (copying humans?),IOU,,,,,,,,,,,,162,,,,,,,,,,,,,,,,,,,,,,,,,,,,,,,,,,,,,,,,,,,,,,,,,,,,,,,,,
great apes,Pan troglodytes,Chimpanzee,,reach,stir_mix,stir water with leaf sponge,IOU,,,,,,,,,,,,163,Borderline case (aim is unclear),,,,,,,,,,,,,,,,,,,,,,,,,,,,,,,,,,,,,,,,,,,,,,,,,,,,,,,,
great apes,Pan troglodytes,Chimpanzee,,reach,throw_play,spray birds with a water hose,IOU,,,,,,,,,,,,162,,,,,,,,,,,,,,,,,,,,,,,,,,,,,,,,,,,,,,,,,,,,,,,,,,,,,,,,,
great apes,Pan troglodytes,Chimpanzee,observational,scratch,scratch_autogroom,groom/scratch self with sticks/straw,tooling,egocentric,1,stick to self,dynamic,,yes,1,no,,"Gaspar & Reis 1993; Goodall 1986; King, Stevens & Mellen 1980; Köhler 1925; Kummer 1971",5,"171-172,189,193",Sometimes detach tools for use. One chimp bit the end of a straw to make a sharp point.,,,,,,,,,,,,,,,,,,,,,,,,,,,,,,,,,,,,,,,,,,,,,,,,,,,,,,,,
great apes,Pan troglodytes,Chimpanzee,anecdotal,scratch,scratch_masturbate,rub clitoris with pencil,tooling,egocentric,1,pencil to clitoris,dynamic,,no,,no,,Temerlin 1975,1,172,,,,,,,,,,,,,,,,,,,,,,,,,,,,,,,,,,,,,,,,,,,,,,,,,,,,,,,,,
great apes,Pan troglodytes,Chimpanzee,observational,scratch,tickle_play,tickle self with stones/sticks/objects,tooling,egocentric,1,stick to self,dynamic,,no,,no,,Goodall 1986; Sanz & Morgan 2007,2,171,,,,,,,,,,,,,,,,,,,,,,,,,,,,,,,,,,,,,,,,,,,,,,,,,,,,,,,,,
great apes,Pan troglodytes,Chimpanzee,,symbolize,symbolic_communicate,use language chips to communicate,IOU,,,,,,,,,,,,180,,,,,,,,,,,,,,,,,,,,,,,,,,,,,,,,,,,,,,,,,,,,,,,,,,,,,,,,,
great apes,Pan troglodytes,Chimpanzee,,symbolize,symbolic_play,carry logs/dead animals/dolls (for psychological security),IOU,,,,,,,,,,,,179,,,,,,,,,,,,,,,,,,,,,,,,,,,,,,,,,,,,,,,,,,,,,,,,,,,,,,,,,
great apes,Pan troglodytes,Chimpanzee,,symbolize,trade_reward,Exchange tokens for reward,IOU,,,,,,,,,,,,179-180,,,,,,,,,,,,,,,,,,,,,,,,,,,,,,,,,,,,,,,,,,,,,,,,,,,,,,,,,
great apes,Pan troglodytes,Chimpanzee,,throw,spit_cool,spit water into cup of hot coffee (to cool it down),IOU,,,,,,,,,,,,147,,,,,,,,,,,,,,,,,,,,,,,,,,,,,,,,,,,,,,,,,,,,,,,,,,,,,,,,,
great apes,Pan troglodytes,Chimpanzee,,throw,spit_play,spit water at conspecifics/others,IOU,,,,,,,,,,,,147,,,,,,,,,,,,,,,,,,,,,,,,,,,,,,,,,,,,,,,,,,,,,,,,,,,,,,,,,
great apes,Pan troglodytes,Chimpanzee,,throw,throw_dislodge,throw sticks into tree to break foliage to consume,IOU,,,,,,,,,,,,147,,,,,,,,,,,,,,,,,,,,,,,,,,,,,,,,,,,,,,,,,,,,,,,,,,,,,,,,,
great apes,Pan troglodytes,Chimpanzee,,throw,throw_dislodge,throw ball to knock down food lure,IOU,,,,,,,,,,,,147,,,,,,,,,,,,,,,,,,,,,,,,,,,,,,,,,,,,,,,,,,,,,,,,,,,,,,,,,
great apes,Pan troglodytes,Chimpanzee,,throw,throw_dominance,throw branches/objects as display (in agonistic encounters/frustration),IOU,,,,,,,,,,,,145-147,,,,,,,,,,,,,,,,,,,,,,,,,,,,,,,,,,,,,,,,,,,,,,,,,,,,,,,,,
great apes,Pan troglodytes,Chimpanzee,,throw,throw_dominance,"throw stones into water in display (""throw splash"")",IOU,,,,,,,,,,,,146,,,,,,,,,,,,,,,,,,,,,,,,,,,,,,,,,,,,,,,,,,,,,,,,,,,,,,,,,
great apes,Pan troglodytes,Chimpanzee,,throw,throw_dominance,throw objects to make sound,IOU,,,,,,,,,,,,146-147,,,,,,,,,,,,,,,,,,,,,,,,,,,,,,,,,,,,,,,,,,,,,,,,,,,,,,,,,
great apes,Pan troglodytes,Chimpanzee,,throw,throw_play,throw objects in play (including catching/fetching),IOU,,,,,,,,,,,,146,,,,,,,,,,,,,,,,,,,,,,,,,,,,,,,,,,,,,,,,,,,,,,,,,,,,,,,,,
great apes,Pan troglodytes,Chimpanzee,,throw,throw_teasing,throw sticks/stones/objects at conspecifics (in agression),IOU,,,,,,,,,,,,146-147,,,,,,,,,,,,,,,,,,,,,,,,,,,,,,,,,,,,,,,,,,,,,,,,,,,,,,,,,
great apes,Pan troglodytes,Chimpanzee,,throw,throw_threat,throw objects at other animals (predators/humans/prey),IOU,,,,,,,,,,,,146-147,,,,,,,,,,,,,,,,,,,,,,,,,,,,,,,,,,,,,,,,,,,,,,,,,,,,,,,,,
great apes,Pan troglodytes,Chimpanzee,,throw,throw_unknown,"throw cigarettes out of cage (if burning, onto wet areas)",IOU,,,,,,,,,,,,147,,,,,,,,,,,,,,,,,,,,,,,,,,,,,,,,,,,,,,,,,,,,,,,,,,,,,,,,,
great apes,Pan troglodytes,Chimpanzee,,throw,throw_unknown,"throw branches/objects as thunderstorm display (""rain dance"")",IOU,,,,,,,,,,,,145,,,,,,,,,,,,,,,,,,,,,,,,,,,,,,,,,,,,,,,,,,,,,,,,,,,,,,,,,
great apes,Pan troglodytes,Chimpanzee,observational,wipe,wipe_access,wipe out the inside of fruits/skulls with leaves for food remnants,tooling,allocentric,1,leaf to fruit,dynamic,,no,,no,,"Boesch & Boesch 1990; Teleki 1973b, 1973c; Wrangham 1977",4,177,"Sometimes wipe with pre-chewed leaf with meat (""wadge""), borderline tool manufacture.",,,,,,,,,,,,,,,,,,,,,,,,,,,,,,,,,,,,,,,,,,,,,,,,,,,,,,,,
great apes,Pan troglodytes,Chimpanzee,observational,wipe,wipe_autogroom,"wipe materials from body with leaf/object (""leaf-napkins"")",tooling,egocentric,1,leaf to body,dynamic,,yes,1,no,,"Baldwin 1979; Bernstein 1962; Boesch 1995; Boesch & Boesch-Achermann 2000; Corp et al 2009; Fletcher & Weghorst 2005; Goodall 1964, 1986; Hayes 1951; King, Stevens & Mellen 1980; Köhler 1925; Kortlandt & Kooij 1963; Kuroda 1991; Nishida 1973, 1977; Nishida, Matsusaka & McGrew 2009; McGrew et al. 2009; Nishida et al. 1999; Nishida 2003; Quiatt 2006; Sanz & Morgan 2007; van Lawick–Goodall 1965, 1968, 1970, 1971, 1973; Watts 2008; Wrangham in O'Hara & Lee 2006",28,"176-177,190",Detached leaves for use.,,,,,,,,,,,,,,,,,,,,,,,,,,,,,,,,,,,,,,,,,,,,,,,,,,,,,,,,
great apes,Pan troglodytes,Chimpanzee,,wipe,wipe_autogroom,"touch wounds with leaves (""leaf dab"")",IOU,,,,,,,,,,,,177,Borderline case (aim is unclear),,,,,,,,,,,,,,,,,,,,,,,,,,,,,,,,,,,,,,,,,,,,,,,,,,,,,,,,
great apes,Pan troglodytes,Chimpanzee,anecdotal,wipe,wipe_clear,"brush insects away with leaf (""leaf brush"")",tooling,allocentric,1,leaf to insect,dynamic,,yes,1,no,,Goodall 1986; Nishida 1973; Whiten et al. 1999,3,177,Seen in two wild adults. One crumpled leaves before use.,,,,,,,,,,,,,,,,,,,,,,,,,,,,,,,,,,,,,,,,,,,,,,,,,,,,,,,,
great apes,Pan troglodytes,Chimpanzee,observational,wipe,wipe_unknown,wipe cages/surroundings with cloth/objects (unknown purpose),IOU,,,,,,,,,,,,177,"Captive chimpanzees only, likely imitating caretakers.",,,,,,,,,,,,,,,,,,,,,,,,,,,,,,,,,,,,,,,,,,,,,,,,,,,,,,,,
great apes,Pongo spp,Orangutan,observational,absorb,dip_absorb,absorbing water inside tree holes with leafy branch,tooling,allocentric,1,branch to water,dynamic,,no,,no,,"van Schaik, van Noordwijk,and Wich 2006; van Schaik et al. 2003, 2009",3,125,,,,,,,,,,,,,,,,,,,,,,,,,,,,,,,,,,,,,,,,,,,,,,,,,,,,,,,,,
great apes,Pongo spp,Orangutan,anecdotal,absorb,dip_absorb,use stick to dip paper towl into juice and retrieve it,tooling,allocentric,2,stick to towel; towel to juice,dynamic,static,no,,yes,composite,"Walkup 2009; B. Beck and R. Shumaker, pers. obs.",2,"125,197",Composite tool use. Seen in two captive animals in two different facilities. Paper towel a metatool (it improves the effiency of juice collection),,,,,,,,,,,,,,,,,,,,,,,,,,,,,,,,,,,,,,,,,,,,,,,,,,,,,,,,
great apes,Pongo spp,Orangutan,observational,absorb,place_absorb,"use crumpled leaves, sponges and other objects to absorb water",IOU,,,,,,,,,,,,125,,,,,,,,,,,,,,,,,,,,,,,,,,,,,,,,,,,,,,,,,,,,,,,,,,,,,,,,,
great apes,Pongo spp,Orangutan,observational,affix,place_adorn,place objects on head or body,IOU,,,,,,,,,,,,126,,,,,,,,,,,,,,,,,,,,,,,,,,,,,,,,,,,,,,,,,,,,,,,,,,,,,,,,,
great apes,Pongo spp,Orangutan,observational,affix,place_comfort,drape leaves and other materials in nest,IOU,,,,,,,,,,,,127,,,,,,,,,,,,,,,,,,,,,,,,,,,,,,,,,,,,,,,,,,,,,,,,,,,,,,,,,
great apes,Pongo spp,Orangutan,observational,affix,place_comfort,"draping leaves and branches as a ""branch cushion""",IOU,,,,,,,,,,,,127,,,,,,,,,,,,,,,,,,,,,,,,,,,,,,,,,,,,,,,,,,,,,,,,,,,,,,,,,
great apes,Pongo spp,Orangutan,observational,affix,place_play,place objects on head or body,IOU,,,,,,,,,,,,126,,,,,,,,,,,,,,,,,,,,,,,,,,,,,,,,,,,,,,,,,,,,,,,,,,,,,,,,,
great apes,Pongo spp,Orangutan,observational,affix,place_play,draping vegetation on their head or around neck,IOU,,,,,,,,,,,,126,,,,,,,,,,,,,,,,,,,,,,,,,,,,,,,,,,,,,,,,,,,,,,,,,,,,,,,,,
great apes,Pongo spp,Orangutan,observational,affix,place_protect,"using leaves as ""leaf gloves"" to touch spiny fruits and to climb thorny trees",IOU,,,,,,,,,,,,127,,,,,,,,,,,,,,,,,,,,,,,,,,,,,,,,,,,,,,,,,,,,,,,,,,,,,,,,,
great apes,Pongo spp,Orangutan,anecdotal,affix,place_protect,holding clumps of grass to climb over electrical wire,IOU,,,,,,,,,,,,127,,,,,,,,,,,,,,,,,,,,,,,,,,,,,,,,,,,,,,,,,,,,,,,,,,,,,,,,,
great apes,Pongo spp,Orangutan,anecdotal,affix,place_selfbandage,applying poultices of chewed leaves to wounds on own body,IOU,,,,,,,,,,,,127,,,,,,,,,,,,,,,,,,,,,,,,,,,,,,,,,,,,,,,,,,,,,,,,,,,,,,,,,
great apes,Pongo spp,Orangutan,observational,affix,place_shelter,draping leaves over own body as protection against sun or rain,IOU,,,,,,,,,,,,126,,,,,,,,,,,,,,,,,,,,,,,,,,,,,,,,,,,,,,,,,,,,,,,,,,,,,,,,,
