group,latin_name,species,support,mode,submode,description,tooling_or_IOU,frame_of_reference,number_relations,temporal_order,1_dynamic_relation,2_dynamic_relation,manufacture,steps_manufacture,associative,type_associative,reference,total_references,page,comments,,,,,,,,,,,,,,,,,,,,,,,,,,,,,,,,,,,,,,,,,,,,,,,,,,,,,,,,
great apes,Gorilla spp,Gorilla,anecdotal,wipe,wipe_allogroom,clean infant's body with coconut fibers soaked in water,tooling,allocentric,1,fibers to infant,dynamic,,no,,no,,"Fontaine, Moisson, and Wickings (1995 ",1,136,,,,,,,,,,,,,,,,,,,,,,,,,,,,,,,,,,,,,,,,,,,,,,,,,,,,,,,,,
great apes,Gorilla spp,Gorilla,observational,wipe,wipe_autogroom,wiping  own body  with towels/objects,tooling,egocentric,1,towel to self,dynamic,,no,,no,,Gómez 1999; Gould and Snyder 1990,2,136,,,,,,,,,,,,,,,,,,,,,,,,,,,,,,,,,,,,,,,,,,,,,,,,,,,,,,,,,
great apes,Gorilla spp,Gorilla,anecdotal,wipe,wipe_clear,using water to wash loose stool from a rock,IOU,,,,,,,,,,,,136,,,,,,,,,,,,,,,,,,,,,,,,,,,,,,,,,,,,,,,,,,,,,,,,,,,,,,,,,
great apes,Gorilla spp,Gorilla,observational,wipe,wipe_unknown,"wiping surfaces  with towel, straw and other materials (for unknown purpose)",IOU,,,,,,,,,,,,136,,,,,,,,,,,,,,,,,,,,,,,,,,,,,,,,,,,,,,,,,,,,,,,,,,,,,,,,,
great apes,Pan paniscus,Bonobo,observational,absorb,dip_absorb,reach and absorb water with moss/leafy branches,tooling,allocentric,1,moss to water,dynamic,,no,,no,,Hohmann & Fruth 2003; Jordan 1982,2,143,Collect moss from trees for this purpose.,,,,,,,,,,,,,,,,,,,,,,,,,,,,,,,,,,,,,,,,,,,,,,,,,,,,,,,,
great apes,Pan paniscus,Bonobo,,absorb,place_absorb,use leaves/objects to absorb water,IOU,,,,,,,,,,,,143,,,,,,,,,,,,,,,,,,,,,,,,,,,,,,,,,,,,,,,,,,,,,,,,,,,,,,,,,
great apes,Pan paniscus,Bonobo,,affix,place_play,cover bodies/faces with items (in play),IOU,,,,,,,,,,,,143,,,,,,,,,,,,,,,,,,,,,,,,,,,,,,,,,,,,,,,,,,,,,,,,,,,,,,,,,
great apes,Pan paniscus,Bonobo,,affix,place_protect,protect hands with wood-wool when opening coconuts/unscrewing jars,IOU,,,,,,,,,,,,143,,,,,,,,,,,,,,,,,,,,,,,,,,,,,,,,,,,,,,,,,,,,,,,,,,,,,,,,,
great apes,Pan paniscus,Bonobo,,affix,place_shelter,wear leafy branches during rain,IOU,,,,,,,,,,,,143,,,,,,,,,,,,,,,,,,,,,,,,,,,,,,,,,,,,,,,,,,,,,,,,,,,,,,,,,
great apes,Pan paniscus,Bonobo,,affix,place_shelter,hold leaf over head in rain,IOU,,,,,,,,,,,,143,,,,,,,,,,,,,,,,,,,,,,,,,,,,,,,,,,,,,,,,,,,,,,,,,,,,,,,,,
great apes,Pan paniscus,Bonobo,,affix,place_thermo,sprinkle body with water (when hot),IOU,,,,,,,,,,,,143,,,,,,,,,,,,,,,,,,,,,,,,,,,,,,,,,,,,,,,,,,,,,,,,,,,,,,,,,
great apes,Pan paniscus,Bonobo,,bait,place_landmark,lay branches on trail (as directional markers),IOU,,,,,,,,,,,,139,,,,,,,,,,,,,,,,,,,,,,,,,,,,,,,,,,,,,,,,,,,,,,,,,,,,,,,,,
great apes,Pan paniscus,Bonobo,,bait,present_play,rip leaves (as social/play/copulation signal),IOU,,,,,,,,,,,,139,,,,,,,,,,,,,,,,,,,,,,,,,,,,,,,,,,,,,,,,,,,,,,,,,,,,,,,,,
great apes,Pan paniscus,Bonobo,,bait,snatch_play,try to snatch small branch from each other (in play),IOU,,,,,,,,,,,,139,,,,,,,,,,,,,,,,,,,,,,,,,,,,,,,,,,,,,,,,,,,,,,,,,,,,,,,,,
great apes,Pan paniscus,Bonobo,,bait,trade_reward,trade tokens with humans for rewards,IOU,,,,,,,,,,,,139,,,,,,,,,,,,,,,,,,,,,,,,,,,,,,,,,,,,,,,,,,,,,,,,,,,,,,,,,
great apes,Pan paniscus,Bonobo,,brandish,wave_dominance,wave branches (in display to other bonobos/ humans),IOU,,,,,,,,,,,,139,,,,,,,,,,,,,,,,,,,,,,,,,,,,,,,,,,,,,,,,,,,,,,,,,,,,,,,,,
great apes,Pan paniscus,Bonobo,,brandish,wave_extinguish,wave towel (to extinguish candle),IOU,,,,,,,,,,,,139,,,,,,,,,,,,,,,,,,,,,,,,,,,,,,,,,,,,,,,,,,,,,,,,,,,,,,,,,
great apes,Pan paniscus,Bonobo,,brandish,wave_play,wave branches (in play),IOU,,,,,,,,,,,,139,,,,,,,,,,,,,,,,,,,,,,,,,,,,,,,,,,,,,,,,,,,,,,,,,,,,,,,,,
great apes,Pan paniscus,Bonobo,,brandish,wave_ward,use vegetation to swat away flies,IOU,,,,,,,,,,,,139,,,,,,,,,,,,,,,,,,,,,,,,,,,,,,,,,,,,,,,,,,,,,,,,,,,,,,,,,
great apes,Pan paniscus,Bonobo,observational,club,club_play,club animals/conspecifics with branches (in play),tooling,allocentric,1,branch to animal,dynamic,,no,,no,,"Kano 1979; Gold 2002; Walraven, vanElsacker & Verheyen 1993",3,139-140,Kano reports secondhand observation.,,,,,,,,,,,,,,,,,,,,,,,,,,,,,,,,,,,,,,,,,,,,,,,,,,,,,,,,
great apes,Pan paniscus,Bonobo,observational,club,club_threat,club animals/conspecifics with branches (in aggression),tooling,allocentric,1,branch to animal,dynamic,,no,,no,,"Kano 1979; Gold 2002; Walraven, vanElsacker & Verheyen 1993",3,139-140,Kano reports secondhand observation.,,,,,,,,,,,,,,,,,,,,,,,,,,,,,,,,,,,,,,,,,,,,,,,,,,,,,,,,
great apes,Pan paniscus,Bonobo,,contain,contain_hold,use containers for urine/saliva/water,IOU,,,,,,,,,,,,142,,,,,,,,,,,,,,,,,,,,,,,,,,,,,,,,,,,,,,,,,,,,,,,,,,,,,,,,,
great apes,Pan paniscus,Bonobo,,contain,contain_hold,fill container and transport water,IOU,,,,,,,,,,,,142,,,,,,,,,,,,,,,,,,,,,,,,,,,,,,,,,,,,,,,,,,,,,,,,,,,,,,,,,
great apes,Pan paniscus,Bonobo,,contain,contain_hold,place objects/food in container to move,IOU,,,,,,,,,,,,142-143,,,,,,,,,,,,,,,,,,,,,,,,,,,,,,,,,,,,,,,,,,,,,,,,,,,,,,,,,
great apes,Pan paniscus,Bonobo,anecdotal,contain,scoop_access,scoop juice with rind (to drink),tooling,allocentric,1,rind to juice,dynamic,,no,,no,,Andre et al pers comm,1,142,Pers comm. Borderline tool manufacture.,,,,,,,,,,,,,,,,,,,,,,,,,,,,,,,,,,,,,,,,,,,,,,,,,,,,,,,,
great apes,Pan paniscus,Bonobo,anecdotal,contain,scoop_access,scoop water with leaf (to drink),tooling,allocentric,1,leaf to water,dynamic,,yes,1,no,,Andre et al pers comm,1,"142,188",Pers comm. rolled large leaf into cup,,,,,,,,,,,,,,,,,,,,,,,,,,,,,,,,,,,,,,,,,,,,,,,,,,,,,,,,
great apes,Pan paniscus,Bonobo,,contain,scoop_access,scoop juice water with bucket,IOU,,,,,,,,,,,,142,Borderline case (aim is unclear) There were more cases in the text above where the aim is unclear I guess we have to decide whetherto  rate all or none of them as tooling,,,,,,,,,,,,,,,,,,,,,,,,,,,,,,,,,,,,,,,,,,,,,,,,,,,,,,,,
great apes,Pan paniscus,Bonobo,anecdotal,cut,cut_allogroom,cut another's hair with scissors,tooling,allocentric,1,scissors to hair,dynamic,,no,,no,,Niio 2000,1,141,Seen in only one experimental animal (Panbanisha),,,,,,,,,,,,,,,,,,,,,,,,,,,,,,,,,,,,,,,,,,,,,,,,,,,,,,,,
great apes,Pan paniscus,Bonobo,anecdotal,dig,dig_unknown,dig with stick,tooling,allocentric,1,stick to dirt,dynamic,,no,,no,,Andre et al pers comm,1,140,Pers comm.,,,,,,,,,,,,,,,,,,,,,,,,,,,,,,,,,,,,,,,,,,,,,,,,,,,,,,,,
great apes,Pan paniscus,Bonobo,,drag,drag_communicate,drag small trees while traveling (to communicate direction /encourage traveling together),IOU,,,,,,,,,,,,138,,,,,,,,,,,,,,,,,,,,,,,,,,,,,,,,,,,,,,,,,,,,,,,,,,,,,,,,,
great apes,Pan paniscus,Bonobo,,drag,drag_dominance,drag small trees/objects (as agonistic display/ excitement),IOU,,,,,,,,,,,,138-139,,,,,,,,,,,,,,,,,,,,,,,,,,,,,,,,,,,,,,,,,,,,,,,,,,,,,,,,,
great apes,Pan paniscus,Bonobo,,drag,drag_play,drag objects (in play),IOU,,,,,,,,,,,,139,,,,,,,,,,,,,,,,,,,,,,,,,,,,,,,,,,,,,,,,,,,,,,,,,,,,,,,,,
great apes,Pan paniscus,Bonobo,,drag,roll_play,roll objects (in play),IOU,,,,,,,,,,,,139,,,,,,,,,,,,,,,,,,,,,,,,,,,,,,,,,,,,,,,,,,,,,,,,,,,,,,,,,
great apes,Pan paniscus,Bonobo,,drop,drop_courtship,drop vegetation as courtship,IOU,,,,,,,,,,,,137-138,,,,,,,,,,,,,,,,,,,,,,,,,,,,,,,,,,,,,,,,,,,,,,,,,,,,,,,,,
great apes,Pan paniscus,Bonobo,,drop,drop_play,drop leaves (in play),IOU,,,,,,,,,,,,138,,,,,,,,,,,,,,,,,,,,,,,,,,,,,,,,,,,,,,,,,,,,,,,,,,,,,,,,,
great apes,Pan paniscus,Bonobo,,hang,hang_play,place branches/rope on bars as swings,IOU,,,,,,,,,,,,142,,,,,,,,,,,,,,,,,,,,,,,,,,,,,,,,,,,,,,,,,,,,,,,,,,,,,,,,,
great apes,Pan paniscus,Bonobo,anecdotal,jab,jab_open,jab canister with stick (to try and open),tooling,allocentric,1,stick to canister,dynamic,,no,,no,,"Walraven, van Elsacker & Verheyen 1993",1,140,,,,,,,,,,,,,,,,,,,,,,,,,,,,,,,,,,,,,,,,,,,,,,,,,,,,,,,,,
great apes,Pan paniscus,Bonobo,anecdotal,jab,jab_play,jab conspecific with stick (in play),tooling,allocentric,1,stick to conspecific,static,,no,,no,,"Walraven, van Elsacker & Verheyen 1993",1,140,,,,,,,,,,,,,,,,,,,,,,,,,,,,,,,,,,,,,,,,,,,,,,,,,,,,,,,,,
great apes,Pan paniscus,Bonobo,anecdotal,pound,hammer_open,hammer food open with hammer on anvil,tooling,allocentric,1,stone to food,dynamic,,no,,no,,Andre et al pers comm,1,140,Pers comm.,,,,,,,,,,,,,,,,,,,,,,,,,,,,,,,,,,,,,,,,,,,,,,,,,,,,,,,,
great apes,Pan paniscus,Bonobo,anecdotal,pound,hammer_play,hit xylophone with xylophone hammer,tooling,allocentric,1,hammer to xylophone,dynamic,,no,,no,,Niio 2000,1,140,Seen in only one experimental animal (Kanzi),,,,,,,,,,,,,,,,,,,,,,,,,,,,,,,,,,,,,,,,,,,,,,,,,,,,,,,,
great apes,Pan paniscus,Bonobo,experimental,pound/cut,cut_access,hammer stone against another stone to make flake tool then used it for cutting,tooling,allocentric,1,1) stone to stone 2) flake to substrate,dynamic,stonetoobject,yes,1,yes,sequential,Savage-Rumbaugh et al 2007; Schick et al 1999; Toth et al 1993,3,"140,187,198",Seen in only one experimental animal (Kanzi). Rare case of using a tool to make a tool.,,,,,,,,,,,,,,,,,,,,,,,,,,,,,,,,,,,,,,,,,,,,,,,,,,,,,,,,
great apes,Pan paniscus,Bonobo,experimental,probe,fish_access,probe for termites in mounds with sticks,tooling,allocentric,1,stick to mound,dynamic,,yes, 1-2,no,,"Badrian, Badrian & Susman 1981; Parish 1994; White et al. 2008; BilaIsa 2003",4,"141,188","Seen in zoo bonobos given artificial mounds, only the evidence of stick tools have been found to indiciate wild use. Zoo bonobos removed leaves/barks and modified size.",,,,,,,,,,,,,,,,,,,,,,,,,,,,,,,,,,,,,,,,,,,,,,,,,,,,,,,,
great apes,Pan paniscus,Bonobo,anecdotal,probe,insert_unlock,use key to open lock,tooling,allocentric,1,key to lock,dynamic,,no,,no,,Niio 2000; Segerdahl et al 2005,2,141,,,,,,,,,,,,,,,,,,,,,,,,,,,,,,,,,,,,,,,,,,,,,,,,,,,,,,,,,
great apes,Pan paniscus,Bonobo,anecdotal,probe,probe_access,extract food from small spaces with objects,tooling,allocentric,1,object to foofd,dynamic,,no,,no,,Ingmanson 1988; Jordan 1982,2,141,,,,,,,,,,,,,,,,,,,,,,,,,,,,,,,,,,,,,,,,,,,,,,,,,,,,,,,,,
great apes,Pan paniscus,Bonobo,anecdotal,probe,probe_allogroom,use twig to clean human's finger nails,tooling,allocentric,1,twig to finger il,dynamic,,yes,1,no,,Ikeo 1993,1,"141,187",Seen in only one experimental animal (Kanzi). Detached twig.,,,,,,,,,,,,,,,,,,,,,,,,,,,,,,,,,,,,,,,,,,,,,,,,,,,,,,,,
great apes,Pan paniscus,Bonobo,observational,probe,probe_autogroom,insert objects to probe nose/ears,tooling,egocentric,1,object to nose/ear,dynamic,,no,,no,,"Jordan 1982; Walraven, van Elsacker, and Verheyen 1993",3,141,,,,,,,,,,,,,,,,,,,,,,,,,,,,,,,,,,,,,,,,,,,,,,,,,,,,,,,,,
great apes,Pan paniscus,Bonobo,anecdotal,probe,probe_autogroom,use small twig to clean between teeth,tooling,egocentric,1,stick to mouth,dynamic,,yes,1,no,,"Ingmanson 1992, 1996",2,"141,188",Seen in only one wild (provisioned) male. Reshaped by biting the end of the stick before use.,,,,,,,,,,,,,,,,,,,,,,,,,,,,,,,,,,,,,,,,,,,,,,,,,,,,,,,,
great apes,Pan paniscus,Bonobo,experimental,probe,probe_dislodge,insert tube to break support for hanging fruit,tooling,allocentric,1,tube to support,static,,no,,no,,Mulcahy & Call 2006,1,141,"Correctly selected tool from array, and saved/transported up to 14h for future use",,,,,,,,,,,,,,,,,,,,,,,,,,,,,,,,,,,,,,,,,,,,,,,,,,,,,,,,
great apes,Pan paniscus,Bonobo,,probe,probe_explore,insert straw/objects to probe environment,IOU,,,,,,,,,,,,141,,,,,,,,,,,,,,,,,,,,,,,,,,,,,,,,,,,,,,,,,,,,,,,,,,,,,,,,,
great apes,Pan paniscus,Bonobo,experimental,probe,push_access,insert stick to push reward from tube,tooling,allocentric,1,stick to tube,dynamic,,yes,1,no,,Martin-Ordas et al. 2008; Mulcahy & Call 2006; Visalberghi et al. 1995,3,"141,187-188",Modified an H-shaped stick to fit in tube (but also many errors made),,,,,,,,,,,,,,,,,,,,,,,,,,,,,,,,,,,,,,,,,,,,,,,,,,,,,,,,
great apes,Pan paniscus,Bonobo,experimental,probe,reach_access,insert stick to rake reward from tube,tooling,allocentric,1,stick to tube,dynamic,,yes,1,no,,Martin-Ordas et al. 2008; Mulcahy & Call 2006; Visalberghi et al. 1995,3,"141,187-188",Modified an H-shaped stick to fit in tube (but also many errors made),,,,,,,,,,,,,,,,,,,,,,,,,,,,,,,,,,,,,,,,,,,,,,,,,,,,,,,,
great apes,Pan paniscus,Bonobo,,prop,prop_locomote,place tree trunks on water (to use as bridge),IOU,,,,,,,,,,,,142,,,,,,,,,,,,,,,,,,,,,,,,,,,,,,,,,,,,,,,,,,,,,,,,,,,,,,,,,
great apes,Pan paniscus,Bonobo,,prop,prop_locomote,balance poles to climb/jump,IOU,,,,,,,,,,,,142,,,,,,,,,,,,,,,,,,,,,,,,,,,,,,,,,,,,,,,,,,,,,,,,,,,,,,,,,
great apes,Pan paniscus,Bonobo,,prop,prop_locomote,prop logs/ladders to climb,IOU,,,,,,,,,,,,142,,,,,,,,,,,,,,,,,,,,,,,,,,,,,,,,,,,,,,,,,,,,,,,,,,,,,,,,,
great apes,Pan paniscus,Bonobo,,prop,prop_mate,place object under copulation partner to factiliate intromission,IOU,,,,,,,,,,,,142,,,,,,,,,,,,,,,,,,,,,,,,,,,,,,,,,,,,,,,,,,,,,,,,,,,,,,,,,
great apes,Pan paniscus,Bonobo,,prop,prop_otherlocomote,Reposition conspecifics to climb on them,IOU,,,,,,,,,,,,142,,,,,,,,,,,,,,,,,,,,,,,,,,,,,,,,,,,,,,,,,,,,,,,,,,,,,,,,,
great apes,Pan paniscus,Bonobo,,prop,prop_rest,use blocks/objects as a seat,IOU,,,,,,,,,,,,142,,,,,,,,,,,,,,,,,,,,,,,,,,,,,,,,,,,,,,,,,,,,,,,,,,,,,,,,,
great apes,Pan paniscus,Bonobo,anecdotal,pry,pry_remove,use sticks as levers to break mesh of enclosure,tooling,allocentric,1,stick to mesh,dynamic,,no,,no,,Ingmanson 1988; Jordan 1982,2,140,,,,,,,,,,,,,,,,,,,,,,,,,,,,,,,,,,,,,,,,,,,,,,,,,,,,,,,,,
great apes,Pan paniscus,Bonobo,,pry,pry_unknown,put bent branch in mouth forcing jaws open,IOU,,,,,,,,,,,,140,,,,,,,,,,,,,,,,,,,,,,,,,,,,,,,,,,,,,,,,,,,,,,,,,,,,,,,,,
great apes,Pan paniscus,Bonobo,anecdotal,reach,brush_allogroom,brush a human's hair,tooling,allocentric,1,brush to hair,dynamic,,no,,no,,Niio 2000,1,140,Seen in only one experimental animal (Kanzi),,,,,,,,,,,,,,,,,,,,,,,,,,,,,,,,,,,,,,,,,,,,,,,,,,,,,,,,
great apes,Pan paniscus,Bonobo,anecdotal,reach,jab_access,use stick with papaya as eating utensil,tooling,allocentric,1,stick to papaya,dynamic,,no,,no,,Andre et al pers comm,1,140,Seen in only one captive animal. Pers comm,,,,,,,,,,,,,,,,,,,,,,,,,,,,,,,,,,,,,,,,,,,,,,,,,,,,,,,,
great apes,Pan paniscus,Bonobo,observational/experimental,reach,reach_access,reach objects with sticks/tools,tooling,allocentric,1,stick to object,dynamic,,no,,no,,"Jordan 1982; Walraven, van Elsacker & Verheyen 1993; Andre et al pers comm; Mulcahy & Call 2006",4,140-141,,,,,,,,,,,,,,,,,,,,,,,,,,,,,,,,,,,,,,,,,,,,,,,,,,,,,,,,,
great apes,Pan paniscus,Bonobo,,reach,reach_access,Pick up ants with grass pieces,IOU,,,,,,,,,,,,140,,,,,,,,,,,,,,,,,,,,,,,,,,,,,,,,,,,,,,,,,,,,,,,,,,,,,,,,,
great apes,Pan paniscus,Bonobo,anecdotal,reach,reach_explore,Touch frightening objects at distance,tooling,allocentric,1,stick to object,dynamic,,no,,no,,Jordan 1982,1,140,Borderline.,,,,,,,,,,,,,,,,,,,,,,,,,,,,,,,,,,,,,,,,,,,,,,,,,,,,,,,,
great apes,Pan paniscus,Bonobo,anecdotal,reach,reach_extinguish,extinguish candle with knife tip,tooling,allocentric,1,knife to flame,static,,no,,no,,Niio 2000,1,140,Seen in only one experimental animal (Kanzi),,,,,,,,,,,,,,,,,,,,,,,,,,,,,,,,,,,,,,,,,,,,,,,,,,,,,,,,
great apes,Pan paniscus,Bonobo,anecdotal,reach,stir_mix,stir hot liquid with spoon,tooling,allocentric,1,spoon to liquid,dynamic,,no,,no,,Ikeo 1993,1,140,Seen in only one experimental animal (Panbanisha),,,,,,,,,,,,,,,,,,,,,,,,,,,,,,,,,,,,,,,,,,,,,,,,,,,,,,,,
great apes,Pan paniscus,Bonobo,anecdotal,scratch,brush_allogroom,brush human/toy teeth with toothbrush,tooling,allocentric,1,brush to teeth,dynamic,,no,,no,,Savage-Rumbaugh et al 1993,1,141,Seen in only one experimental animal (Kanzi),,,,,,,,,,,,,,,,,,,,,,,,,,,,,,,,,,,,,,,,,,,,,,,,,,,,,,,,
great apes,Pan paniscus,Bonobo,anecdotal,scratch,brush_autogroom,brush own teeth with toothbrush,tooling,egocentric,1,brush to teeth,dynamic,,no,,no,,Savage-Rumbaugh et al 1993,1,141,Seen in only one experimental animal (Kanzi),,,,,,,,,,,,,,,,,,,,,,,,,,,,,,,,,,,,,,,,,,,,,,,,,,,,,,,,
great apes,Pan paniscus,Bonobo,observational,scratch,scratch_autogroom,rub bodies with objects to scratch,tooling,egocentric,1,object to body,dynamic,,no,,no,,"Walraven, van Elsacker, and Verheyen 1993 ",1,141,,,,,,,,,,,,,,,,,,,,,,,,,,,,,,,,,,,,,,,,,,,,,,,,,,,,,,,,,
great apes,Pan paniscus,Bonobo,observational,scratch,scratch_autogroom,scratch body parts with sticks,tooling,egocentric,1,stick to body,dynamic,,yes,1,no,,Hohmann & Fruth 2003; Ingmanson 1996; Walraven et al 1993,3,"141,187",One wild female detached a twig from a tree before using it to scratch.,,,,,,,,,,,,,,,,,,,,,,,,,,,,,,,,,,,,,,,,,,,,,,,,,,,,,,,,
great apes,Pan paniscus,Bonobo,observational,scratch,scratch_masturbate,masturbate with leaves/objects,tooling,egocentric,1,object to self,dynamic,,no,,no,,"Kuroda (982; Walkup, pers. obs.; Walraven, van Elsacker, and Verheyen 1993 ",3,141,,,,,,,,,,,,,,,,,,,,,,,,,,,,,,,,,,,,,,,,,,,,,,,,,,,,,,,,,
great apes,Pan paniscus,Bonobo,,symbolize,place_landmark,use vegetation along trail to convey information,IOU,,,,,,,,,,,,143-144,,,,,,,,,,,,,,,,,,,,,,,,,,,,,,,,,,,,,,,,,,,,,,,,,,,,,,,,,
great apes,Pan paniscus,Bonobo,,throw,throw_open,throw stone to make stone flakes,IOU,,,,,,yes,1,,,,,138,**Tool making but not tooling,,,,,,,,,,,,,,,,,,,,,,,,,,,,,,,,,,,,,,,,,,,,,,,,,,,,,,,,
great apes,Pan paniscus,Bonobo,,throw,throw_play,throw vegetation/objects at conspecifics/humans (in play),IOU,,,,,,,,,,,,138,,,,,,,,,,,,,,,,,,,,,,,,,,,,,,,,,,,,,,,,,,,,,,,,,,,,,,,,,
great apes,Pan paniscus,Bonobo,,throw,throw_threat,throw vegetation/objects at conspecifics/humans (agonistic display),IOU,,,,,,,,,,,,138,,,,,,,,,,,,,,,,,,,,,,,,,,,,,,,,,,,,,,,,,,,,,,,,,,,,,,,,,
great apes,Pan paniscus,Bonobo,observational,wipe,wipe_autogroom,use leaves/objects to wipe off faeces/urine/other off of body,tooling,egocentric,1,leaf to body,dynamic,,no,,no,,"Andre et al pers comm; Ingmanson 1996; Jordan 1982; Walraven, van Elsacker, and Verheyen 1993",4,143,,,,,,,,,,,,,,,,,,,,,,,,,,,,,,,,,,,,,,,,,,,,,,,,,,,,,,,,,
great apes,Pan paniscus,Bonobo,,wipe,wipe_unknown,wipe windows/floors with towel (possibly copying caretakers),IOU,,,,,,,,,,,,143,Borderline case (aim is unclear). Believed to be imitation of caretakers.,,,,,,,,,,,,,,,,,,,,,,,,,,,,,,,,,,,,,,,,,,,,,,,,,,,,,,,,
great apes,Pan troglodytes,Chimpanzee,observational/experimental,absorb,dip_absorb,"use chewed/crumpled vegetation (""leaf sponge"") to reach water/palm juice/liquid in hole",tooling,allocentric,1,sponge to water,dynamic,,yes, 1-2,no,,"Bettinger & Carter 1991; Biro, Sousa & Matsuzawa 2006; Boesch & Boesch 1990; Brewer 1978; Goodall 1964, 1986; Hunt & McGrew 2002; Lanjouw 2002; Marchant, McGrew & Hunt 2007; McGrew 1977; Norikoshi & Kitahara 1979; Parker 1968, 1969; Sanz & Morgan 2007; Sousa & Matsuzawa 2004; Sugiyama 1989, 1995; Tonooka 2001; Tonooka, Tomonaga & Matsuzawa 1997; Matsusaka & Kutsukake 2002; Matsusaka et al. 2006; Ohashi 2006; Quiatt 2001, 2006; Reynolds 2005; Sugiyama 1994; Takasaki 1992; Takasaki & Tsukahara in Nishida 1990; Teleki 1973b, 1973c; Tutin, Ham & Wrogemann 1995; van Lawick-Goodall 1965, 1968, 1970, 1971, 1973; Watts 2008; Whiten et al. 1999; Wrangham 1975, 1977",41,"175-176,190,195",Detached leaves/collect moss for use/break stick in half. Chew into sponge. See pound for associative tool use involving reaching juice after pounding hole in palm.,,,,,,,,,,,,,,,,,,,,,,,,,,,,,,,,,,,,,,,,,,,,,,,,,,,,,,,,
great apes,Pan troglodytes,Chimpanzee,,absorb,place_absorb,place vegetation/objects in liquids to suck,IOU,,,,,,,,,,,,175-176,,,,,,,,,,,,,,,,,,,,,,,,,,,,,,,,,,,,,,,,,,,,,,,,,,,,,,,,,
great apes,Pan troglodytes,Chimpanzee,,absorb,place_absorb,dip fruit/food in water,IOU,,,,,,,,,,,,175,,,,,,,,,,,,,,,,,,,,,,,,,,,,,,,,,,,,,,,,,,,,,,,,,,,,,,,,,
great apes,Pan troglodytes,Chimpanzee,,affix,place_adorn,place branches/objects on selves (in adornment),IOU,,,,,,,,,,,,177-178,,,,,,,,,,,,,,,,,,,,,,,,,,,,,,,,,,,,,,,,,,,,,,,,,,,,,,,,,
great apes,Pan troglodytes,Chimpanzee,,affix,place_comfort,line surface of nests with leafy twigs/leaves,IOU,,,,,,,,,,,,178-179,,,,,,,,,,,,,,,,,,,,,,,,,,,,,,,,,,,,,,,,,,,,,,,,,,,,,,,,,
great apes,Pan troglodytes,Chimpanzee,anecdotal,affix,place_ignite,light cigarette with another lit cigarette,tooling,allocentric,1,cigarette to cigarette,dynamic,,no,,no,,Brink 1957,1,179,Seen in two captive animals.,,,,,,,,,,,,,,,,,,,,,,,,,,,,,,,,,,,,,,,,,,,,,,,,,,,,,,,,
great apes,Pan troglodytes,Chimpanzee,,affix,place_play,place branches/objects on selves (in play),IOU,,,,,,,,,,,,177-178,,,,,,,,,,,,,,,,,,,,,,,,,,,,,,,,,,,,,,,,,,,,,,,,,,,,,,,,,
great apes,Pan troglodytes,Chimpanzee,,affix,place_protect,cover insect in cloth before smashing,IOU,,,,,,,,,,,,178,,,,,,,,,,,,,,,,,,,,,,,,,,,,,,,,,,,,,,,,,,,,,,,,,,,,,,,,,
great apes,Pan troglodytes,Chimpanzee,,affix,place_protect,"grasp sticks by feet during locomotion (as protection) (""stepping sticks"")",IOU,,,,,,,,,,,,179,,,,,,,,,,,,,,,,,,,,,,,,,,,,,,,,,,,,,,,,,,,,,,,,,,,,,,,,,
great apes,Pan troglodytes,Chimpanzee,,affix,place_protect,"place parasite on leaf to squash (""leaf-squash"")",IOU,,,,,,,,,,,,179,,,,,,,,,,,,,,,,,,,,,,,,,,,,,,,,,,,,,,,,,,,,,,,,,,,,,,,,,
great apes,Pan troglodytes,Chimpanzee,,affix,place_rest,"place vegetation/boxes to sit on (to avoid uncomfortable surfaces) (""seat sticks"" / ""leaf cushions"" / "" seat vegetation"")",IOU,,,,,,,,,,,,178-179,,,,,,,,,,,,,,,,,,,,,,,,,,,,,,,,,,,,,,,,,,,,,,,,,,,,,,,,,
great apes,Pan troglodytes,Chimpanzee,,affix,place_shelter,use branches as rain cover,IOU,,,,,,,,,,,,177,,,,,,,,,,,,,,,,,,,,,,,,,,,,,,,,,,,,,,,,,,,,,,,,,,,,,,,,,
great apes,Pan troglodytes,Chimpanzee,,affix,place_wedge,prop up anvil with small stone wedge,IOU,,,,,,,,,,,,179,,,,,,,,,,,,,,,,,,,,,,,,,,,,,,,,,,,,,,,,,,,,,,,,,,,,,,,,,
great apes,Pan troglodytes,Chimpanzee,,affix,sand_unknown,"sand furniture with sandpaper (unknown reason, likely copying)",IOU,,,,,,,,,,,,179,Seen in only one experimental animal (Viki). Imitating caretakers.,,,,,,,,,,,,,,,,,,,,,,,,,,,,,,,,,,,,,,,,,,,,,,,,,,,,,,,,
great apes,Pan troglodytes,Chimpanzee,anecdotal,affix,scratch_masturbate,use suction hose vacuum cleaner to masturbate,tooling,egocentric,1,vacuum to genitals,static,,no,,no,,Temerlin 1975,1,179,Seen in only one experimental animal (Lucy).,,,,,,,,,,,,,,,,,,,,,,,,,,,,,,,,,,,,,,,,,,,,,,,,,,,,,,,,
great apes,Pan troglodytes,Chimpanzee,,bait,bait_attract,lure animals with food (to attack),IOU,,,,,,,,,,,,150,,,,,,,,,,,,,,,,,,,,,,,,,,,,,,,,,,,,,,,,,,,,,,,,,,,,,,,,,
great apes,Pan troglodytes,Chimpanzee,,bait,bait_share,share meat between individuals (for sex or alliances?),IOU,,,,,,,,,,,,150-151,,,,,,,,,,,,,,,,,,,,,,,,,,,,,,,,,,,,,,,,,,,,,,,,,,,,,,,,,
great apes,Pan troglodytes,Chimpanzee,,bait,groom_unknown,"groom leaves (""leaf-grooming"") (to get attention or perk up grooming bouts?)",IOU,,,,,,,,,,,,150,,,,,,,,,,,,,,,,,,,,,,,,,,,,,,,,,,,,,,,,,,,,,,,,,,,,,,,,,
great apes,Pan troglodytes,Chimpanzee,,bait,place_sound,"pull a leaf through lIOU/teeth/fingers to produce noise (""leaf-clipping"" / ""billet-doux"" / ""leaf-strip"" / ""stem pull-through"") (as communicative signal? Courtship? Frustration?)",IOU,,,,,,,,,,,,149-150,,,,,,,,,,,,,,,,,,,,,,,,,,,,,,,,,,,,,,,,,,,,,,,,,,,,,,,,,
great apes,Pan troglodytes,Chimpanzee,,bait,present_appease,take an infant to halt an agonistic interaction,IOU,,,,,,,,,,,,150,,,,,,,,,,,,,,,,,,,,,,,,,,,,,,,,,,,,,,,,,,,,,,,,,,,,,,,,,
great apes,Pan troglodytes,Chimpanzee,,bait,present_play,"display an object (to initiate play behaviour) (""play-start"")",IOU,,,,,,,,,,,,150,,,,,,,,,,,,,,,,,,,,,,,,,,,,,,,,,,,,,,,,,,,,,,,,,,,,,,,,,
great apes,Pan troglodytes,Chimpanzee,,bait,snatch_attention,carry off infant sibling to get mother to follow,IOU,,,,,,,,,,,,150,,,,,,,,,,,,,,,,,,,,,,,,,,,,,,,,,,,,,,,,,,,,,,,,,,,,,,,,,
great apes,Pan troglodytes,Chimpanzee,,bait,trade_reward,exchange objects with humans,IOU,,,,,,,,,,,,151,,,,,,,,,,,,,,,,,,,,,,,,,,,,,,,,,,,,,,,,,,,,,,,,,,,,,,,,,
great apes,Pan troglodytes,Chimpanzee,,block,block_trap,leave stick in termite mounds as stopper,IOU,,,,,,,,,,,,172,,,,,,,,,,,,,,,,,,,,,,,,,,,,,,,,,,,,,,,,,,,,,,,,,,,,,,,,,
great apes,Pan troglodytes,Chimpanzee,,brandish,shake_courtship,"wave/shake branches at females (""branching""/""branch-shake"") (as courtship)",IOU,,,,,,,,,,,,148-149,,,,,,,,,,,,,,,,,,,,,,,,,,,,,,,,,,,,,,,,,,,,,,,,,,,,,,,,,
great apes,Pan troglodytes,Chimpanzee,,brandish,shake_threat,"wave/shake branches at conspecifics/other animals (""branching""/""branch-shake"") (intimidation)",IOU,,,,,,,,,,,,148-149,,,,,,,,,,,,,,,,,,,,,,,,,,,,,,,,,,,,,,,,,,,,,,,,,,,,,,,,,
great apes,Pan troglodytes,Chimpanzee,,brandish,wave_play,brandish sticks in play,IOU,,,,,,,,,,,,149,,,,,,,,,,,,,,,,,,,,,,,,,,,,,,,,,,,,,,,,,,,,,,,,,,,,,,,,,
great apes,Pan troglodytes,Chimpanzee,,brandish,wave_ward,wave objects to disperse insects,IOU,,,,,,,,,,,,150,,,,,,,,,,,,,,,,,,,,,,,,,,,,,,,,,,,,,,,,,,,,,,,,,,,,,,,,,
great apes,Pan troglodytes,Chimpanzee,observational,club,club_hunt,"kill bees with sticks to eat/access nest (""bee-probe"")",tooling,allocentric,1,stick to bee,dynamic,,no,,no,,Boesch & Boesch 1990; Whiten et al 1999,2,151-152,,,,,,,,,,,,,,,,,,,,,,,,,,,,,,,,,,,,,,,,,,,,,,,,,,,,,,,,,
great apes,Pan troglodytes,Chimpanzee,observational/experimental,club,club_play,club conspecifics/animals with sticks (in play),tooling,allocentric,1,stick to conspecific,dynamic,,no,,no,,"Albrecht & Dunnett 1971; Boesch 1991; Boesch & Boesch 1990; Fletcher & Weghorst 2005; Goodall 1986; Hirata et al. 2001; Köhler 1925; Kollar 1972; Itani & Suzuki 1967; Kortlandt 1965, 1967a, 1967b; Kortlandt & Kooij 1963; Kummer & Goodall 1985; van Lawick–Goodall 1968, 1970, 1971; Linden 2002; Matsusaka 2007; McGrew pers comm; Nishida 1970; Nishida 2003; Nishida et al. 1999; Savage 1976; Sheak 1924; Takeshita & van Hooff 1996, 2001; van Hooff 1973; Vancatova 2008; Watts 2008; Whiten et al 2001; Wilson & Wilson 1968",32,151-152,,,,,,,,,,,,,,,,,,,,,,,,,,,,,,,,,,,,,,,,,,,,,,,,,,,,,,,,,
